dataid,video_id,trending_date,title,channel_title,category_id,publish_time,views,likes,dislikes,comment_count,comments_disabled,ratings_disabled,video_error_or_removed
2695,MU29Wqg_BVo,2017-11-27,Brazil's Video Game Gray Markets,Cloth Map,Travel & Events,2017-11-22 15:01:16,72789,5211,29,315,False,False,False
2696,0Rt329xQUjM,2017-11-27,Brad and Sean Evans Make Cast-Iron Pizza | It's Alive | Bon Appétit,Bon Appétit,Howto & Style,2017-11-21 16:56:15,330100,11083,203,1142,False,False,False
2697,0PW9MWDWLH8,2017-11-27,WHISPER CHALLENGE w/ MY MOM // Grace Helbig,Grace Helbig,People & Blogs,2017-11-22 08:23:18,140694,10625,61,873,False,False,False
2698,-xt_j2aIAkg,2017-11-27,Predator Is Back,adidas Football,Sports,2017-11-22 09:10:18,2318522,8722,1686,871,False,False,False
2699,lfkYyrhWphE,2017-11-27,Shawn Mendes - There's Nothing Holdin' Me Back (Live From The 2017 American Music Awards),ShawnMendesVEVO,Music,2017-11-21 17:42:54,1964795,150293,876,8672,False,False,False
2700,UQHSK-kgONk,2017-11-27,Portugal. The Man - Feel It Still [2017 American Music Awards Performance],Portugal. The Man,Music,2017-11-21 18:50:21,242776,4960,73,312,False,False,False
2701,3oXhLdeuxDw,2017-11-27,Bus Photobombs The Weather Channel's Stream of Georgia Dome Implosion,The Weather Channel,News & Politics,2017-11-20 20:16:53,1086098,11497,352,1930,False,False,False
2702,G_Pu00NmJfg,2017-11-27,The Ultimate Nacho Showdown with Brad Leone and Sean Evans | Sean in the Wild,First We Feast,Howto & Style,2017-11-21 16:04:29,405836,10183,208,1052,False,False,False
2703,4L-BPQVZYXM,2017-11-27,Razer Phone Review: The Real Deal!,Marques Brownlee,Science & Technology,2017-11-21 19:52:07,1515285,53605,1278,5866,False,False,False
2704,eZQdQ5pV6EE,2017-11-27,TEACHING CASEY HOW TO VLOG,Peter McKinnon,People & Blogs,2017-11-21 13:18:50,486452,27918,430,4290,False,False,False
2705,kKFNThEiilU,2017-11-27,Voices,Doug Jones for Senate,People & Blogs,2017-11-21 02:30:47,151705,1407,391,584,False,False,False
2706,HszBf-CJeVE,2017-11-27,Zendaya's Wavy-Curly Hair Tutorial,Zendaya,Entertainment,2017-11-21 17:51:10,1419942,61888,709,3106,False,False,False
2707,XcUiOyKclOI,2017-11-27,Kelly Clarkson - Miss Independent / Love So Soft [2017 American Music Awards Performance],Kelly Clarkson,Music,2017-11-21 15:56:31,107273,4197,37,286,False,False,False
2708,Yhea380bYp0,2017-11-27,Green Day - 2000 Light Years Away,Green Day,Music,2017-11-21 19:02:57,207033,18192,164,1295,False,False,False
2709,bAfn2duIlN8,2017-11-27,🎃 How to make Pumpkin Pie Mistakes,iJustine,People & Blogs,2017-11-21 19:39:43,178072,7822,299,1208,False,False,False
2710,3k6RD9zVvpE,2017-11-27,Musical Fiction | Rudy Mancuso,Rudy Mancuso,Comedy,2017-11-20 21:07:17,3203154,197222,1453,11330,False,False,False
2711,X5DWRXTOUD0,2017-11-27,THINGS PARENTS DO ON CHRISTMAS | MYLIFEASEVA,MyLifeAsEva,Howto & Style,2017-11-21 23:32:56,728354,46195,1640,3741,False,False,False
2712,tj3EKWwIulQ,2017-11-27,Sarah Michelle Gellar Vs. Sarah Michelle Prinze,HARRY,Entertainment,2017-11-22 19:00:16,3780,0,0,0,True,True,False
2713,BQC09Mdn24w,2017-11-27,HOLIDAY SLAY MAKEUP TUTORIAL,James Charles,Entertainment,2017-11-21 23:40:15,514444,31918,1539,3863,False,False,False
2714,CWrjDoEBQsw,2017-11-27,How To Make A THANKSGIVING ROAST HAM Out Of Pink Vanilla CAKE | Yolanda Gampp | How To Cake It,How To Cake It,Howto & Style,2017-11-21 15:59:21,598891,22754,295,2099,False,False,False
2715,uU3kLBo_ruo,2017-11-27,The Nuclear Waste Problem,Wendover Productions,Education,2017-11-21 15:30:02,572898,25229,1545,4896,False,False,False
2716,7Bgj9c48zHU,2017-11-27,How to do a beauty Vlog for Tarte Cosmetics,Sailor J,Entertainment,2017-11-21 17:44:17,107174,12392,101,4099,False,False,False
2717,VdugkldCx10,2017-11-27,When We're Together (From Olaf's Frozen Adventure/Official Lyric Video),DisneyMusicVEVO,Music,2017-11-21 20:00:01,228114,8545,241,493,False,False,False
2718,aZdkR_WhA5Q,2017-11-27,"The Walking Dead: No Man’s Land by Inanna Sarkis, Hannah Stocking & Anwar Jibawi",Inanna Sarkis,Comedy,2017-11-20 18:01:12,1549556,49052,1997,1835,False,False,False
2719,FTv-CE43PpM,2017-11-27,Justice League Could Lose WB Big Money - SJU,ScreenJunkies News,Entertainment,2017-11-21 19:47:18,90131,1958,216,846,False,False,False
2720,fbL1ZoAQgUU,2017-11-27,First Interstellar Asteroid Wows Scientists,NASA Jet Propulsion Laboratory,Science & Technology,2017-11-20 19:34:42,1234081,9477,395,2293,False,False,False
2721,vSRAOvhFF1I,2017-11-27,Volunteering with YouTubers,Tyler Oakley,Entertainment,2017-11-21 19:59:24,93508,8668,108,398,False,False,False
2722,fEjag-a7TyU,2017-11-27,Georgia Dome Implosion  - TWC Camera Man Losing It LIVE,Duston Ward,Sports,2017-11-20 13:40:31,1237792,10780,562,746,False,False,False
2723,leFNoUJmJ9o,2017-11-27,Guessing Objects I Got In The Mail #4,The Tommy Edison Experience,People & Blogs,2017-11-22 01:14:10,26302,1904,11,304,False,False,False
2724,i2ZHwnKVXK0,2017-11-27,Gaining Super Powers,Buttered Side Down,Comedy,2017-11-21 18:00:06,165000,5280,90,359,False,False,False
2725,dLRZTBtdMUg,2017-11-27,(HD VERSION) Kelly Clarkson & P!nk Everybody Hurts LIVE at the 2017 American Music Awards!,slaymeclarkson c:,Music,2017-11-20 19:13:47,201114,3315,128,145,False,False,False
2726,UhZ56rcWwRQ,2017-11-27,A Wrinkle in Time Official US Trailer,Disney Movie Trailers,Film & Animation,2017-11-20 01:22:15,2304396,24067,5459,5569,False,False,False
2727,IuYFvaNHJug,2017-11-27,Nick Jonas - Find You (Live From The 2017 American Music Awards),NickJonasVEVO,Music,2017-11-21 22:53:10,212237,9987,132,422,False,False,False
2728,_akwfRuL4os,2017-11-27,Highlights of the EA predatory behavior announcement,Chris Lee,People & Blogs,2017-11-21 19:29:03,196933,0,0,1947,False,True,False
2729,Ft-cmkjgOlk,2017-11-27,Anti Tank Crossbow!,Turbo Conquering Mega Eagle,Film & Animation,2017-11-22 15:48:04,19639,204,24,72,False,False,False
2730,SJUhFjNfaZY,2017-11-27,How to turn your car crash into a catchy song,DreamCastle_629,Music,2017-10-17 15:31:08,69982,498,42,74,False,False,False
2731,w2Es7-c9GAk,2017-11-27,Selena Gomez Delivers Emotional First Performance of 'Wolves' at the AMAs -- Watch!,Entertainment Tonight,Music,2017-11-20 04:59:46,2016852,9691,2595,2112,False,False,False
2732,jH2t4Tcl3Pg,2017-11-27,Bruno Mars - Live At The Apollo Theater [Official Trailer] (November 29th on CBS),Bruno Mars,Music,2017-11-20 16:14:48,816960,28643,573,1560,False,False,False
2733,PE7ZhHirBFk,2017-11-27,MATCHA RED BEAN CUPCAKES - The Scran Line,The Scran Line,Howto & Style,2017-11-22 13:34:51,22786,1349,25,221,False,False,False
2734,YkLzdHTv3G0,2017-11-27,Explosm Presents: Channelate - Thankful,ExplosmEntertainment,Comedy,2017-11-20 06:00:01,800625,37372,926,2022,False,False,False
2735,EbuCLC_wVlM,2017-11-27,Victoria’s Secret Model Sara Sampaio’s Easy Bombshell Makeup Look | Beauty Secrets | Vogue,Vogue,Entertainment,2017-11-21 14:54:23,437349,16642,179,537,False,False,False
2736,6LuHS7ZeSjE,2017-11-27,EVERY FAMILY GATHERING EVER,Smosh,Comedy,2017-11-20 17:00:01,1112006,38196,1299,2436,False,False,False
2737,FaJmopuuhZE,2017-11-27,Josh Groban - Happy Xmas (War Is Over) [Official Music Video],Josh Groban,Music,2017-11-20 16:00:08,176102,4642,174,564,False,False,False
2738,pmdVVDkvJXU,2017-11-27,"Saoirse Ronan on Harassment, Need to Know There's Support Here No Matter What | Close Up With THR",The Hollywood Reporter,Entertainment,2017-11-21 15:00:05,90507,1454,16,278,False,False,False
2739,wx-M8sxcOp8,2017-11-27,Eagles vs. Cowboys | NFL Week 11 Game Highlights,NFL,Sports,2017-11-20 04:57:26,1462885,10301,751,4623,False,False,False
2740,uLHygq6Mm-0,2017-11-27,Marvel's Agents of SHIELD Season 5 Trailer (HD),TV Promos,Entertainment,2017-11-20 17:08:25,86386,1108,57,202,False,False,False
2741,KQkkgD2p3Ow,2017-11-27,U2 - American Soul (Lyric Video),U2VEVO,Music,2017-11-20 16:00:02,383461,7460,587,1089,False,False,False
2742,R8hccXRk3MI,2017-11-27,Cooking A Turkey on a Car Engine,Good Mythical Morning,Entertainment,2017-11-20 11:00:03,626248,9632,1519,1015,False,False,False
2743,8HTdbCohTXY,2017-11-27,Ratko Mladic found guilty of genocide over Bosnia war - BBC News,BBC News,News & Politics,2017-11-22 11:22:07,22974,276,170,654,False,False,False
2744,6JvRVILczps,2017-11-27,Gatorade | Sisters in Sweat ft. Serena Williams,Gatorade,Sports,2017-11-20 13:55:03,957603,1236,15,49,False,False,False
2745,zOgle88sKro,2017-11-27,The German Town That's Literally Breaking Apart,Tom Scott,Education,2017-11-20 16:00:04,632018,22877,193,1065,False,False,False
2746,RO41_2cWSXA,2017-11-27,All Star but it's an Origami,It's a small world,Music,2017-11-22 01:59:57,27710,2073,89,350,False,False,False
2747,KIFiLnPHUoM,2017-11-27,The Engineering and Culture of the Mechanical Keyboard,HACKADAY,Science & Technology,2017-11-22 19:30:01,2691,51,6,8,False,False,False
2748,aVpvVq_yZLM,2017-11-27,Second Woman Accuses Sen. Al Franken Of Inappropriate Touching | The View,The View,News & Politics,2017-11-20 16:13:29,170075,696,849,1257,False,False,False
2749,XHkAjUVoQME,2017-11-27,My Birth Father in Russia didn't know I existed - This is our bond,Alex Gilbert,People & Blogs,2017-11-15 08:02:08,266915,3722,75,246,False,False,False
2750,wFEAoF7RC7Y,2017-11-27,Behind The Sounds: That's Not Me,BehindTheSounds,Music,2008-06-17 00:07:56,86861,469,4,106,False,False,False
2751,qv9Gt38LOKQ,2017-11-27,OnePlus 5T Durability Test! Scratch and Bend tested!,JerryRigEverything,Howto & Style,2017-11-20 14:00:07,726679,25676,614,2624,False,False,False
2752,MfLcjWq6m9o,2017-11-27,360° Norwegian Kelp Forest Soundscape #OurBluePlanet - BBC Earth,BBC Earth,Pets & Animals,2017-11-22 10:00:01,29000,869,33,47,False,False,False
2753,iatq3Rn4vsg,2017-11-27,Holding a Baby for the First Time in Slow Motion - First Takes,Cut,Entertainment,2017-11-20 13:00:04,340965,9448,181,1113,False,False,False
2754,ZJDMWVZta3M,2017-11-27,Incredibles 2 Official Teaser Trailer,Disney•Pixar,Film & Animation,2017-11-18 15:43:11,34043133,439742,14616,47894,False,False,False
2755,9vlKOFd73XM,2017-11-27,Pepsi Uses Aborted Babies to Flavor Test Soda- Alex Jones,Kanimuna Kisaka,News & Politics,2013-03-12 12:56:41,10621,49,23,26,False,False,False
2756,MVes87KrWvs,2017-11-27,Exposing My Internet Search History,ConnorFranta,People & Blogs,2017-11-20 23:15:34,206100,23034,335,1057,False,False,False
2757,X_tYrnv_o6A,2017-11-27,Your Amazing Molecular Machines,Veritasium,Education,2017-11-20 15:00:02,490106,32341,236,3961,False,False,False
2758,aD5dCMBeySA,2017-11-27,Wild Turkey Bourbon & Matthew McConaughey Give Back for Thanksgiving,WildTurkeyBourbon,People & Blogs,2017-11-20 14:04:16,140005,1518,57,240,False,False,False
2759,WKcYTvyoidw,2017-11-27,Parenting Habits That Could Keep Children From Succeeding In Life,Business Insider,News & Politics,2017-11-21 20:00:02,45118,1092,56,289,False,False,False
2760,2a52cBN9qOA,2017-11-27,Additional Remains Of Miami Gardens Soldier Recovered,CBS Miami,News & Politics,2017-11-21 17:26:32,2171,12,2,17,False,False,False
2761,gO_QM9oUcM0,2017-11-27,A scene from Suicide Club 2.avi,Srinath .S,People & Blogs,2012-02-13 08:18:13,87105,406,27,140,False,False,False
2762,vNya04dlC4I,2017-11-27,Highlights from the 2017 American Music Awards,Washington Post,Entertainment,2017-11-20 15:38:58,62469,199,281,236,False,False,False
2763,ZkPSbp3zTfo,2017-11-27,"Come Back, Barack - SNL",Saturday Night Live,Entertainment,2017-11-19 07:13:11,3320677,62276,3745,7079,False,False,False
2764,TIQqb80eg24,2017-11-27,BTS Sings Camila Cabello's 'Havana' & Shows Off Some Red Carpet Dance Moves! | AMAs 2017,Billboard,Music,2017-11-20 04:45:11,2535143,117722,1937,10040,False,False,False
2765,7cTi6PHUqMw,2017-11-27,Are Critics What Killed Justice League? Sony Pay Too Much For Tarantino? - The John Campea Show,John Campea,Entertainment,2017-11-21 17:00:14,40251,1426,85,822,False,False,False
2766,8mCcM-PUmLM,2017-11-27,I Dressed Like It Was 1977,Safiya Nygaard,People & Blogs,2017-11-19 21:29:25,2382878,119254,1404,10148,False,False,False
2767,NYizLfEYKuY,2017-11-27,This Is the Most Expensive Steak in New York City — The Meat Show,Eater,Howto & Style,2017-11-20 15:00:03,195525,2205,148,231,False,False,False
2768,euaGS3tPRBw,2017-11-27,Stephen Colbert & John Oliver Take Over The Stage | Night Of Too Many Stars | HBO,HBO,Film & Animation,2017-11-19 17:59:04,2143706,27662,2086,2934,False,False,False
2769,7COF8AhH9Z8,2017-11-27,Celebrations in Zimbabwe after Robert Mugabe resigns,CNN,News & Politics,2017-11-21 16:16:18,30156,203,46,301,False,False,False
2770,ai_UWoM37dI,2017-11-27,R.I.P Arya,Dwarf Mamba,Entertainment,2017-11-18 19:55:30,6988208,368569,8898,103635,False,False,False
2771,Nt4tJHp27u0,2017-11-27,THE END! :(,Colleen Vlogs,Comedy,2017-11-21 06:49:17,138467,8693,179,1060,False,False,False
2772,aXLS_WDIugk,2017-11-27,Jackson Pollock in 60 seconds,Royal Academy of Arts,Entertainment,2016-11-10 19:37:00,17616,49,1,2,False,False,False
2773,QY83PJXQYXc,2017-11-27,SDC GOES BEHIND THE SCENES OF CAVALIERS VS PISTONS GAME!,NBA,Sports,2017-11-22 02:22:03,27862,1605,44,260,False,False,False
2774,f45Va7jMSx4,2017-11-27,HOW TO TAKE KIDS TO A RESTAURANT,How to DAD,People & Blogs,2017-11-19 23:02:11,157286,4637,187,281,False,False,False
2775,Y8JGfi4MJ8k,2017-11-27,SAOIRSE RONAN - MORONIC (IRONIC),flirppy242,Music,2008-08-07 12:16:58,26710,78,1,8,False,False,False
2776,Kn5UgGQukYQ,2017-11-27,Breaking Bad's Bryan Cranston on Meeting Charles Manson,hudsonunionsociety,Film & Animation,2016-10-14 21:14:51,37346,0,0,0,True,True,False
2777,aKPz583WRpQ,2017-11-27,Funny Japanese Game Show Slippery Stairs - Just Hilarious,Just Wow me,Entertainment,2017-11-18 19:22:56,2659593,20003,723,2151,False,False,False
2778,v6d1rShfyZk,2017-11-27,YouTube Back on Echo Show,Voicebot,People & Blogs,2017-11-21 16:02:44,4386,2,2,1,False,False,False
2779,SW3X7-gk8q0,2017-11-27,Fall Out Boy - Yule Shoot Your Eye Out (Audio),FallOutBoyVEVO,Music,2017-11-20 05:00:02,437509,36907,306,4449,False,False,False
2780,YcCrw6d3UX4,2017-11-27,President Donald Trump Pardons His First Thanksgiving Turkey At White House Ceremony | NBC News,NBC News,News & Politics,2017-11-21 19:18:02,6183,56,29,54,False,False,False
2781,0s6-iFoCFNQ,2017-11-27,Gordon is Served “The Weirdest Pizza I’ve Ever Seen!” | Kitchen Nightmares,Kitchen Nightmares,Entertainment,2017-11-18 17:00:00,2788162,27260,896,3970,False,False,False
2782,cyhU06cXfeU,2017-11-27,10 Ways to Tell If You're OBSESSED with Christmas!! Alisha Marie,AlishaMarie,Howto & Style,2017-11-19 19:28:53,1456636,93590,895,15339,False,False,False
2783,mN4JWnTOSmg,2017-11-27,Drake - Virginia Black commercial,The Sports King,People & Blogs,2017-11-19 20:23:56,27571,286,6,41,False,False,False
2784,6SjslBAJkJI,2017-11-27,Passenger | Simple Song (Official Video),Passenger,Music,2017-11-19 17:59:32,382766,13924,211,894,False,False,False
2785,cH4E_t3m3xM,2017-11-27,"Selena Gomez, Marshmello - Wolves",SelenaGomezVEVO,Music,2017-11-18 16:00:02,20752341,804496,17557,44075,False,False,False
2786,QME3eyBXqpU,2017-11-27,This Is How a Victoria's Secret Fashion Show 2017 Costume Gets Made,ELLE,Howto & Style,2017-11-21 21:17:44,327739,6231,52,160,False,False,False
2787,c9m52-psUmw,2017-11-27,African Grey Parrot swearing in an Irish accent,Marie McGann,Entertainment,2016-06-02 23:05:57,9078,28,9,7,False,False,False
2788,caN18WcW5XU,2017-11-27,"Hailee Steinfeld & Alesso Let Me Go ft Florida Georgia Line,watt AMA live",David Sistaro,Music,2017-11-20 01:45:52,140887,1659,41,127,False,False,False
2789,k-qUBZWor4I,2017-11-27,OU QB Baker Mayfield addresses the punishment given to him,Bob Przybylo,Sports,2017-11-21 00:24:05,13016,18,8,52,False,False,False
2790,9Tb3xPmr3yg,2017-11-27,Search continues for missing Argentine submarine with 44 crew members onboard,ABC News,News & Politics,2017-11-19 15:44:28,88952,591,59,594,False,False,False
2791,YRRczTwopgA,2017-11-27,My Favorite Thanksgiving Recipe || Mayim Bialik,Mayim Bialik,Film & Animation,2017-11-20 16:31:23,34059,2183,375,622,False,False,False
2792,U44YLdW9AL4,2017-11-27,The Horrors of Flavored Water,Simon and Martina,Travel & Events,2017-11-19 12:35:07,270360,11727,359,1685,False,False,False
2793,qvLyNeMGdR4,2017-11-27,Ford Thunderbird SC commercial (1989),John Sellars,Entertainment,2016-12-28 05:34:48,1689,7,0,2,False,False,False
2794,j7I-d1B6HwE,2017-11-27,2017 American Music Awards: All The Show-Stopping Performances!,Access Hollywood,Entertainment,2017-11-20 05:33:03,139186,371,124,88,False,False,False
2795,WeOwqu6gOPs,2017-11-27,Last Workout Before the Victoria's Secret Fashion Show | Karlie Kloss,Klossy,People & Blogs,2017-11-20 10:23:00,247842,10893,76,373,False,False,False
2796,Xk_Gv89jzas,2017-11-27,Dominoes Pizza Delivery on Bike,ViralHog,Autos & Vehicles,2017-11-20 20:33:38,4524,44,7,9,False,False,False
2797,a9i2wTxsxV0,2017-11-27,The Adventures of Ford Fairlane: Springloaded gun mishap,Spectrum Haleskarth,Film & Animation,2015-09-21 23:40:45,6122,16,0,8,False,False,False
2798,F86S9Uc4mP4,2017-11-27,McDonald's Will No Longer Serve This Fan Favorite Drink,Mashed,Entertainment,2017-11-18 21:00:00,1080069,9673,857,4038,False,False,False
2799,avDL9JRcmgs,2017-11-27,DipClip | Chicken Nugget Rally Testing | How secure is your sauce?,Milkmen Design,People & Blogs,2017-11-13 14:39:03,5696,8,0,1,False,False,False
2800,THr_seahKUI,2017-11-28,2017 Christmas Decorations at the White House,The White House,News & Politics,2017-11-27 14:17:59,249943,8353,5345,4437,False,False,False
2801,uZ1M3DkKCEI,2017-11-28,"Pitbull, Fifth Harmony - Por Favor (Official Video)",PitbullVEVO,Music,2017-11-27 14:00:43,1361217,107470,4720,10223,False,False,False
2802,5qxqo2CQakA,2017-11-28,EVERY STAR WARS FAN EVER,Smosh,Comedy,2017-11-27 17:00:00,656403,24365,3926,2594,False,False,False
2803,515lLZS082U,2017-11-28,Pitch Perfect 3 - Riff-Off Clip [HD],Pitch Perfect,Entertainment,2017-11-27 03:00:21,2154309,43029,2294,2543,False,False,False
2804,UVaeRX9LybU,2017-11-28,PREGNANCY ANNOUNCEMENT After Two Miscarriages | Our Baby Has A Heart Beat! 👶🏼,Ellie and Jared,People & Blogs,2017-11-27 17:42:18,491113,39786,932,10542,False,False,False
2805,NKin_i1pcFA,2017-11-28,"The Spyker C8 Is the Quirkiest $250,000 Exotic Car in History",Doug DeMuro,Autos & Vehicles,2017-11-27 17:00:48,705169,21050,532,5784,False,False,False
2806,QzfnWcHhdyQ,2017-11-28,Packers vs. Steelers | NFL Week 12 Game Highlights,NFL,Sports,2017-11-27 05:22:00,1172709,11033,958,3510,False,False,False
2807,UqItlHUSN-4,2017-11-28,[OFFICIAL VIDEO] Deck The Halls - Pentatonix,PTXofficial,Music,2017-11-27 15:00:54,849365,63174,1465,7191,False,False,False
2808,f3uZxD39awA,2017-11-28,Meghan Markle Engaged To Prince Harry | The View,The View,Entertainment,2017-11-27 16:14:14,185894,1499,564,1180,False,False,False
2809,2mrOcJNPxEc,2017-11-28,Prince Harry And Meghan Markle Are Engaged And Royal Wedding Set For Spring | TODAY,TODAY,News & Politics,2017-11-27 13:50:01,117714,858,229,534,False,False,False
2810,GBhrvR838Ag,2017-11-28,Prince Harry and Meghan Markle reveal proposal details,CNN,News & Politics,2017-11-27 18:48:15,31055,326,169,338,False,False,False
2811,w2A8q3XIhu0,2017-11-28,Why Hold Music Sounds Worse Now,Tom Scott,Education,2017-11-27 16:00:04,306872,17220,146,1018,False,False,False
2812,2fGXDFiFBhg,2017-11-28,DON'T Buy The iPhone X,Unbox Therapy,Science & Technology,2017-11-26 15:59:15,3412680,168804,13699,46196,False,False,False
2813,LQicq60aJaw,2017-11-28,FULL Interview: Prince Harry and Meghan Markle  - BBC News,BBC News,News & Politics,2017-11-27 19:38:39,219570,2702,223,950,False,False,False
2814,o7OwzKm8aa0,2017-11-28,2017 VS 1987 makeover,AnthonyPadilla,Comedy,2017-11-27 18:35:39,161404,16482,180,1649,False,False,False
2815,wppAQ8uZpfQ,2017-11-28,How Millennials Are Killing the Diamond Industry,Cracked,Comedy,2017-11-26 17:00:06,644576,29669,4862,4963,False,False,False
2816,sOIBkZsGb0A,2017-11-28,Should You Confess Feelings To A Friend? / Gaby & Allison,Just Between Us,Comedy,2017-11-27 16:00:06,91925,4113,211,475,False,False,False
2817,QssLKnUk6pg,2017-11-28,Ray J. and Princess Love’s Big News!,The Real Daytime,Entertainment,2017-11-27 17:40:44,142846,3222,81,360,False,False,False
2818,lOT0GOyw2pY,2017-11-28,The robot-proof job men aren't taking,Vox,News & Politics,2017-11-27 11:00:02,553261,16396,1892,4204,False,False,False
2819,d-NCySETRIc,2017-11-28,Black Mirror - Crocodile | Official Trailer [HD] | Netflix,Netflix,Entertainment,2017-11-26 22:00:01,367311,6292,139,553,False,False,False
2820,m7CtnR47w20,2017-11-28,Quality Audio Recording for Video,ElectroBOOM,Science & Technology,2017-11-27 17:18:29,203696,14631,165,1373,False,False,False
2821,H-kKZujl8CI,2017-11-28,Timelapse shows Bali volcano Mount Agung spewing ash after minor eruptions,Guardian News,News & Politics,2017-11-26 13:22:34,422732,851,328,253,False,False,False
2822,KrxDhokzEv4,2017-11-28,Razer Phone Durability test - Scratch BURN and BEND tested!,JerryRigEverything,Howto & Style,2017-11-27 15:27:42,388786,18376,412,3290,False,False,False
2823,IOuFE-6Awos,2017-11-28,Ellen Makes 'Friends' with BTS!,TheEllenShow,Entertainment,2017-11-27 14:00:02,1548962,122670,1421,15016,False,False,False
2824,X26e3rK5SSM,2017-11-28,Cam'ron - Dinner Time (Mase Diss Track - Official Audio),Cam'ron,Music,2017-11-26 03:30:23,664666,6622,1939,4283,False,False,False
2825,JANApS0P4z8,2017-11-28,Casually Explained: Levels of Wealth,Casually Explained,Comedy,2017-11-25 15:00:03,2304546,104018,3396,6069,False,False,False
2826,bkwLxcfcKTY,2017-11-28,PEACH MACARONS - The Scran Line,The Scran Line,Howto & Style,2017-11-27 14:39:18,27067,1698,43,221,False,False,False
2827,XAzqBDFs418,2017-11-28,Battle with Charlie Puth | Rudy Mancuso,Rudy Mancuso,Comedy,2017-11-27 21:17:31,719229,76088,611,4569,False,False,False
2828,AV5TOlGFHk0,2017-11-28,Best EARLY Cyber Monday 2017 Deals LIVE RIGHT NOW!,The Deal Guy,Science & Technology,2017-11-26 16:00:03,128133,4146,387,3677,False,False,False
2829,qXivpclxftM,2017-11-28,Weird Workout Videos - JonTron,JonTronShow,Comedy,2017-11-25 19:10:42,3003970,203312,4102,24827,False,False,False
2830,RQOgG4MLh1I,2017-11-28,Ed Sheeran delivers a Perfect performance | Live Shows | The X Factor 2017,The X Factor UK,Entertainment,2017-11-26 21:11:11,414269,15405,125,0,True,False,False
2831,iA5u80nS1PQ,2017-11-28,More Pokemon Who Are Disappointed With Their Evolutions,Dorkly,Comedy,2017-11-25 20:09:25,1167158,36480,1340,3596,False,False,False
2832,aQzai9oXb-g,2017-11-28,Trying On Wedding Dresses | November Vlog Pt. 1,clothesencounters,Howto & Style,2017-11-26 22:30:52,333229,13841,233,903,False,False,False
2833,AxWxJNHoLC8,2017-11-28,What Is Schizophrenia Like?,BuzzFeedVideo,People & Blogs,2017-11-25 22:00:07,756320,18776,1508,2252,False,False,False
2834,sfweKCYOPFc,2017-11-28,7 Things You've Been Using Wrong Your Whole Life,BuzzFeed Nifty,Howto & Style,2017-11-25 18:00:47,265774,2209,2047,494,False,False,False
2835,CzCfd0eaWoA,2017-11-28,We Bought a 100 Year Old Fixer Upper - Man Vs House Ep.1,ThreadBanger,Howto & Style,2017-11-25 19:10:01,1239500,85638,1024,7844,False,False,False
2836,VKW64fQwzRc,2017-11-28,CFL 105th Grey Cup - Calgary Stampeders vs Toronto Argonauts Full Highlights,CFL Insider,Sports,2017-11-27 11:57:50,29733,290,18,168,False,False,False
2837,SCR1KeLDZxw,2017-11-28,$1000 PR Unboxing With Beauty Editor | Beauty With Mi | Refinery29,Refinery29,Howto & Style,2017-11-27 16:00:02,17372,504,23,81,False,False,False
2838,Bzji05zubSc,2017-11-28,2017 Miss Universe National Costume Show,Miss Universe,Entertainment,2017-11-26 03:11:00,613960,3843,357,1219,False,False,False
2839,F1b5ouja_VI,2017-11-28,Markiplier Makes: Breakfast,Markiplier,Comedy,2017-11-25 19:00:34,646729,38963,479,1808,False,False,False
2840,pmS2oJQ8SIs,2017-11-28,"J.T. Barrett cuts through the Wolverines' defense, Michigan leads to 14-7 | FOX COLLEGE FOOTBALL",FOX Sports,Sports,2017-11-25 18:32:33,116336,441,233,229,False,False,False
2841,VSJ0STT8JRw,2017-11-28,Stop Pitching Sketches About Other Cast Members,CollegeHumor,Comedy,2017-11-25 17:30:01,690690,24559,802,2015,False,False,False
2842,Ort8rZdpoXo,2017-11-28,Miss Universe Crowd Shouts 'Boo!' Not Happy with Ms. Jamaica Just 2nd Runner Up?,Technomanila,Entertainment,2017-11-27 03:55:10,12649,56,35,107,False,False,False
2843,8pffcngJJq0,2017-11-28,Relay attack Solihull,West Midlands Police,News & Politics,2017-11-26 10:13:26,167753,238,74,0,True,False,False
2844,dHDn26UX4aw,2017-11-28,VR Fail: My buddy tried VR for the first time last night. I ended up with a broken TV,Lane Anderson,Comedy,2017-11-24 19:06:37,810165,12137,1220,1823,False,False,False
2845,xArN1yUcXXc,2017-11-28,FAIL COMPILATION - MASSIVE Chain Reaction goes UP the Stairs! ft. berlagawesome,Hevesh5,Entertainment,2017-11-25 18:00:04,170955,2254,333,265,False,False,False
2846,NDBwsMIXlMk,2017-11-28,Marvel’s Agents of S.H.I.E.L.D. | Season 5 Premiere Special Preview,Marvel Entertainment,Entertainment,2017-11-26 16:00:21,456193,9501,294,1678,False,False,False
2847,_6uvQtccJss,2017-11-28,BLACK FRIDAY HAUL 2017 + TRY ON | Bethany Mota,Bethany Mota,Howto & Style,2017-11-25 18:55:42,1124215,68505,1102,47185,False,False,False
2848,nGv8FK28g4s,2017-11-28,KOREAN Beauty Haul - SAILOR MOON Makeup!!,grav3yardgirl,Howto & Style,2017-11-25 21:00:01,364786,13622,776,1747,False,False,False
2849,xGz_FZ0ePwE,2017-11-28,Mase - The Oracle (Cam'Ron Diss),RAP DAILY,Music,2017-11-24 16:04:33,1080099,15794,3563,7262,False,False,False
2850,qKh7JdoPZz4,2017-11-28,Lesser Known BROADWAY Songs - Mystery Solo | Thomas Sanders,Thomas Sanders,Comedy,2017-11-25 21:07:04,259627,26760,237,6667,False,False,False
2851,t4ZsyO1n-kA,2017-11-28,Making The Grand Tour: James's Candidate for the Driver,The Grand Tour,Entertainment,2017-11-25 15:05:10,918520,21270,265,1450,False,False,False
