dataid,video_id,trending_date,title,channel_title,category_id,publish_time,views,likes,dislikes,comment_count,comments_disabled,ratings_disabled,video_error_or_removed
0,2kyS6SvSYSE,2017-11-14,WE WANT TO TALK ABOUT OUR MARRIAGE,CaseyNeistat,People & Blogs,2017-11-13 17:13:01,748374,57527,2966,15954,False,False,False
1,1ZAPwfrtAFY,2017-11-14,The Trump Presidency: Last Week Tonight with John Oliver (HBO),LastWeekTonight,Entertainment,2017-11-13 07:30:00,2418783,97185,6146,12703,False,False,False
2,5qpjK5DgCt4,2017-11-14,"Racist Superman | Rudy Mancuso, King Bach & Lele Pons",Rudy Mancuso,Comedy,2017-11-12 19:05:24,3191434,146033,5339,8181,False,False,False
3,puqaWrEC7tY,2017-11-14,Nickelback Lyrics: Real or Fake?,Good Mythical Morning,Entertainment,2017-11-13 11:00:04,343168,10172,666,2146,False,False,False
4,d380meD0W0M,2017-11-14,I Dare You: GOING BALD!?,nigahiga,Entertainment,2017-11-12 18:01:41,2095731,132235,1989,17518,False,False,False
5,gHZ1Qz0KiKM,2017-11-14,2 Weeks with iPhone X,iJustine,Science & Technology,2017-11-13 19:07:23,119180,9763,511,1434,False,False,False
6,39idVpFF7NQ,2017-11-14,Roy Moore & Jeff Sessions Cold Open - SNL,Saturday Night Live,Entertainment,2017-11-12 05:37:17,2103417,15993,2445,1970,False,False,False
7,nc99ccSXST0,2017-11-14,5 Ice Cream Gadgets put to the Test,CrazyRussianHacker,Science & Technology,2017-11-12 21:50:37,817732,23663,778,3432,False,False,False
8,jr9QtXwC9vc,2017-11-14,The Greatest Showman | Official Trailer 2 [HD] | 20th Century FOX,20th Century Fox,Film & Animation,2017-11-13 14:00:23,826059,3543,119,340,False,False,False
9,TUmyygCMMGA,2017-11-14,Why the rise of the robots won’t mean the end of work,Vox,News & Politics,2017-11-13 13:45:16,256426,12654,1363,2368,False,False,False
10,9wRQljFNDW8,2017-11-14,Dion Lewis' 103-Yd Kick Return TD vs. Denver! | Can't-Miss Play | NFL Wk 10 Highlights,NFL,Sports,2017-11-13 02:05:26,81377,655,25,177,False,False,False
11,VifQlJit6A0,2017-11-14,(SPOILERS) 'Shiva Saves the Day' Talked About Scene Ep. 804 | The Walking Dead,amc,Entertainment,2017-11-13 03:00:00,104578,1576,303,1279,False,False,False
12,5E4ZBSInqUU,2017-11-14,Marshmello - Blocks (Official Music Video),marshmello,Music,2017-11-13 17:00:00,687582,114188,1333,8371,False,False,False
13,GgVmn66oK_A,2017-11-14,Which Countries Are About To Collapse?,NowThis World,News & Politics,2017-11-12 14:00:00,544770,7848,1171,3981,False,False,False
14,TaTleo4cOs8,2017-11-14,SHOPPING FOR NEW FISH!!!,The king of DIY,Pets & Animals,2017-11-12 18:30:01,207532,7473,246,2120,False,False,False
15,kgaO45SyaO4,2017-11-14,The New SpotMini,BostonDynamics,Science & Technology,2017-11-13 20:09:58,75752,9419,52,1230,False,False,False
16,ZAQs-ctOqXQ,2017-11-14,One Change That Would Make Pacific Rim a Classic,Cracked,Comedy,2017-11-12 17:00:05,295639,8011,638,1256,False,False,False
17,YVfyYrEmzgM,2017-11-14,How does your body know you're full? - Hilary Coller,TED-Ed,Education,2017-11-13 16:00:07,78044,5398,53,385,False,False,False
18,eNSN6qet1kE,2017-11-14,HomeMade Electric Airplane,PeterSripol,Science & Technology,2017-11-13 15:30:17,97007,11963,36,2211,False,False,False
19,B5HORANmzHw,2017-11-14,Founding An Inbreeding-Free Space Colony,SciShow,Education,2017-11-12 22:00:01,223871,8421,191,1214,False,False,False
20,vU14JY3x81A,2017-11-14,How Can You Control Your Dreams?,Life Noggin,Education,2017-11-13 14:00:03,115791,9586,75,2800,False,False,False
21,6VhU_T463sU,2017-11-14,The Making of Hela's Headdress from Thor: Ragnarok,Tested,Science & Technology,2017-11-12 15:00:01,224019,3585,138,208,False,False,False
22,_-aDHxoblr4,2017-11-14,Is It Dangerous To Talk To A Camera While Driving?,Tom Scott,Education,2017-11-13 16:00:03,144418,11758,89,1014,False,False,False
23,JBZTZZAcFTw,2017-11-14,"What $4,800 Will Get You In NYC | Sweet Digs Home Tour | Refinery29",Refinery29,Howto & Style,2017-11-12 16:00:01,145921,1707,578,673,False,False,False
24,lZ68j2J_GOM,2017-11-14,Using Other People's Showers,Gus Johnson,Comedy,2017-11-13 14:44:24,33980,4884,52,234,False,False,False
25,dRpNZV18N_g,2017-11-14,SPAGHETTI BURRITO VS SPAGHETTI BURRITO,HellthyJunkFood,Entertainment,2017-11-12 14:00:04,223077,8676,193,1392,False,False,False
26,fcVjitaM3LY,2017-11-14,78557 and Proth Primes - Numberphile,Numberphile,Science & Technology,2017-11-13 12:13:36,80705,4687,41,437,False,False,False
27,qeWvgZLz9yU,2017-11-14,A Smart... MUG?! - Take apart a Heated Thermos!,JerryRigEverything,Howto & Style,2017-11-13 16:00:03,120727,9033,224,1346,False,False,False
28,iIxy3JN3-jc,2017-11-14,LeBron James admits he was ripping Phil Jackson and thinks DeShaun Watson should be the Browns qu...,Cleveland Cavaliers on cleveland.com,News & Politics,2017-11-13 15:42:28,27943,156,36,83,False,False,False
29,n30k5CwLhS4,2017-11-14,Nick Andopolis: Drummer,FaeryInLoveInc,Film & Animation,2011-05-29 17:03:12,50867,715,238,246,False,False,False
30,U0hAC8O7RoI,2017-11-14,"I TOOK THE $3,000,000 LAMBO TO CARMAX! They offered me......",hp_overload,Autos & Vehicles,2017-11-13 01:43:12,98378,4035,495,486,False,False,False
31,CBVGjS_EJok,2017-11-14,Amazon Christmas Advert 2017 - Toys & Games,Amazon.co.uk,Entertainment,2017-11-06 17:52:50,26000,119,69,0,True,False,False
32,n1WpP7iowLc,2017-11-14,Eminem - Walk On Water (Audio) ft. Beyoncé,EminemVEVO,Music,2017-11-10 17:00:03,17158531,787419,43420,125882,False,False,False
33,hz7ukDjuq4w,2017-11-14,What's Inside a Detectives Car?,officer401,Entertainment,2017-11-12 23:41:37,67661,3781,84,626,False,False,False
34,p2hJxyF7mok,2017-11-14,New Emirates First Class Suite | Boeing 777 | Emirates,Emirates,Travel & Events,2017-11-12 05:55:42,141148,1661,70,236,False,False,False
35,0mlNzVSJrT0,2017-11-14,Me-O Cats Commercial,Nobrand,People & Blogs,2017-04-21 06:47:32,98966,2486,184,532,False,False,False
36,Om_zGhJLZ5U,2017-11-14,TL;DW - Every DCEU Movie Before Justice League,Screen Junkies,Film & Animation,2017-11-12 18:00:03,288922,7515,792,2111,False,False,False
37,e_7zHm7GsYc,2017-11-14,Hunter Hayes - You Should Be Loved (Part One Of Pictures),Hunter Hayes,Music,2017-11-13 15:01:18,13917,1318,24,76,False,False,False
38,dQvIbulWCM4,2017-11-14,Celebrities on Thanksgiving 2017!,Niki and Gabi,Comedy,2017-11-12 23:41:48,605932,38397,1387,3412,False,False,False
39,zZ9FciUx6gs,2017-11-14,Nickelback - The Betrayal Act III [Official Video],Nickelback,Music,2017-11-13 15:31:44,57169,6927,161,565,False,False,False
40,PaJCFHXcWmM,2017-11-14,U2 - The Blackout,U2VEVO,Music,2017-11-13 17:00:04,60506,5389,106,455,False,False,False
41,goP4Z5wyOlM,2017-11-14,Iraq-Iran earthquake: Deadly tremor hits border region - BBC News,BBC News,News & Politics,2017-11-12 21:16:40,34785,308,26,413,False,False,False
42,NZFhMSgbKKM,2017-11-14,Dennis Smith Jr. and LeBron James go back and forth,Ben Rohrbach,Sports,2017-11-13 15:11:00,945,7,5,8,False,False,False
43,0tO_l_Ed5Rs,2017-11-14,Matthew Santoro - FACTS (Official Music Video) f. Ellevan & Humble the Poet,MatthewSantoro,Music,2017-11-11 16:00:01,328330,15186,15448,7484,False,False,False
44,STI2fI7sKMo,2017-11-14,"AFFAIRS, EX BOYFRIENDS, $18MILLION NET WORTH - GOOGLE US | Shawn and Andrew",Shawn Johnson East,People & Blogs,2017-11-11 15:00:03,321053,4451,1772,895,False,False,False
45,BWPrk9PUwQE,2017-11-14,iPhone X vs Makeup Transformation (Face ID TEST),dope2111,Howto & Style,2017-11-12 00:45:54,1456472,33505,1660,2160,False,False,False
46,ogYum4kWXgk,2017-11-14,People are Awesome & The Pet Collective present Pets are Awesome!,People are Awesome,Entertainment,2017-11-13 13:00:06,69844,3417,33,160,False,False,False
47,sbcbvuitiTc,2017-11-14,Stephon Marbury and Jimmer Fredette fight in China,NBA Highlights · YouTube,Sports,2017-11-10 18:23:05,956169,2017,2425,1447,False,False,False
48,zNqCVTs38nU,2017-11-14,Heidelberg's nifty hook-and-lateral to the left tackle,D3sports.com,Sports,2017-11-13 02:15:30,4569,35,18,19,False,False,False
49,DM-ni_LSOFE,2017-11-14,"ELDERS REACT TO iPHONE X (Facial Recognition, Animojis)",FBE,Entertainment,2017-11-10 23:05:25,2045386,45406,2842,8309,False,False,False
50,0PpNlNJ6Nng,2017-11-14,Will It Watermarble?! Sister Edition | Watermarbling 9 random objects in nail polish!,Simply Nailogical,Entertainment,2017-11-11 19:03:43,1842393,99086,1339,11800,False,False,False
51,c-3JxzN2u34,2017-11-14,Lin-Manuel Miranda's next act: Helping rebuild Puerto Rico,CBS Sunday Morning,News & Politics,2017-11-12 15:05:55,6473,205,6,15,False,False,False
52,069D0NmW39o,2017-11-14,"Wildest Superstar distractions: WWE Top 10, Nov. 11, 2017",WWE,Sports,2017-11-11 15:00:00,1044813,15397,838,1100,False,False,False
53,9t9u_yPEidY,2017-11-14,"Jennifer Lopez - Amor, Amor, Amor (Official Video) ft. Wisin",JenniferLopezVEVO,Music,2017-11-10 15:00:00,9548677,190083,15015,11473,False,False,False
54,KODzih-pYlU,2017-11-14,BLIND(folded) CAKE DECORATING CONTEST (with Molly Burke) // Grace Helbig,Grace Helbig,People & Blogs,2017-11-11 18:08:04,197062,7250,217,456,False,False,False
55,8NHA23f7LvU,2017-11-14,Jason Momoa Wows Hugh Grant With Some Dothraki | The Graham Norton Show,The Graham Norton Show,Entertainment,2017-11-10 19:06:23,1496225,16116,236,605,False,False,False
56,w0XYVssCKjw,2017-11-14,JaVale McGee's Parking Lot Chronicles: Episode 3,Kevin Durant,Sports,2017-11-11 20:00:02,162597,5734,106,525,False,False,False
57,9XSULcLI6Hg,2017-11-14,Kellyanne Conway on Roy Moore This Week Abc: Trump’s Not Being Briefed On This Bit By Bit 11/12/17,JimBrowski 96HourNews,News & Politics,2017-11-12 15:24:29,9132,21,8,64,False,False,False
58,pjuPpVLXDQg,2017-11-14,Train Swipes Parked Vehicle,ViralHog,Autos & Vehicles,2017-11-13 00:46:11,7265,89,8,22,False,False,False
59,9xSx-5tmq44,2017-11-14,Daddy's Home 2 - Movie Review,Jeremy Jahns,Entertainment,2017-11-11 06:34:48,291597,8209,344,1062,False,False,False
60,4v0nOAzcG2A,2017-11-14,The Super Google Pixel 2 Camera Upgrade!,Jonathan Morrison,Science & Technology,2017-11-11 15:38:32,290801,10237,377,1016,False,False,False
61,oTObwUiXdYY,2017-11-14,"7.3 Magnitude Earthquake Along Iraq-Iran Border Leaves At Least 400 Dead, 7,200 Injured | TIME",TIME,News & Politics,2017-11-13 15:44:35,5304,52,13,68,False,False,False
62,1cgK-BIrXes,2017-11-14,#VeteransDay: Thank You for Everything,YouTube Spotlight,Entertainment,2017-11-10 15:07:13,812516,26917,1979,4998,False,False,False
63,ujyTQNNjjDU,2017-11-14,G-Eazy - The Plan (Official Video),GEazyMusicVEVO,Music,2017-11-10 05:00:01,2642930,115795,3055,6410,False,False,False
64,PABlVzeldaM,2017-11-14,U.S. Navy Three Carrier Formation in Western Pacific Ocean,U.S. Navy,News & Politics,2017-11-12 13:13:33,105058,493,54,347,False,False,False
65,6340tX9M_eM,2017-11-14,Batman: Gotham by Gaslight - Exclusive Trailer (2018),IGN,Entertainment,2017-11-10 19:00:00,537715,8231,413,970,False,False,False
66,8mhTWqWlQzU,2017-11-14,Wearing Online Dollar Store Makeup For A Week,Safiya Nygaard,People & Blogs,2017-11-11 01:19:33,2744430,115426,1110,6541,False,False,False
67,t4YAyT4ihIQ,2017-11-14,Getting My Driver's License | Lele Pons,Lele Pons,Comedy,2017-11-10 18:30:01,3358068,120876,8279,6408,False,False,False
68,MNiweoKXwfg,2017-11-14,Watch Norman Reedus Come Face to Face with his ‘Walking Dead’ Double,INSIDER,Entertainment,2017-11-13 17:00:26,4732,203,6,33,False,False,False
69,Jw1Y-zhQURU,2017-11-14,John Lewis Christmas Ad 2017 - #MozTheMonster,John Lewis,Howto & Style,2017-11-10 07:38:29,7224515,55681,10247,9479,False,False,False
70,2Vv-BfVoq4g,2017-11-14,Ed Sheeran - Perfect (Official Music Video),Ed Sheeran,Music,2017-11-09 11:04:14,33523622,1634124,21082,85067,False,False,False
71,UFYCTJlayS4,2017-11-14,Top 10 iPhone Apps for Productivity & Content Creation,Sara Dietschy,Film & Animation,2017-11-11 03:56:10,52591,2233,187,255,False,False,False
72,cccyOn99s4Y,2017-11-14,Reacting to Running a Half Marathon | MEGANBYTES EP. 101,MeganBatoon,Entertainment,2017-11-10 23:00:01,75822,2978,147,243,False,False,False
73,abGCYPCk294,2017-11-14,"Justice League Reactions, Should Disney Buy Netflix - The John Campea Show",John Campea,Entertainment,2017-11-11 17:55:27,43715,1550,109,1031,False,False,False
74,lY_0mkYDZDU,2017-11-14,Foster The People - Sit Next to Me (Official Video),fosterthepeopleVEVO,Music,2017-11-10 17:00:05,303956,18603,585,1745,False,False,False
75,k8NxqyGcZA4,2017-11-14,Rosie O’Donnell On Donald Trump’s Hostility Toward Her | WWHL,Watch What Happens Live with Andy Cohen,Entertainment,2017-11-10 12:59:55,238643,2429,5381,2325,False,False,False
76,IE-xepGLVt8,2017-11-14,Mayo Clinic's first face transplant patient meets donor’s family,Mayo Clinic,Science & Technology,2017-11-10 12:04:17,237307,1896,74,260,False,False,False
77,ObIQ0s02UHg,2017-11-14,Jason Derulo - Tip Toe feat. French Montana (Official Lyric Video),Jason Derulo,Music,2017-11-10 14:40:48,1282413,37669,1732,1691,False,False,False
78,cOc3tsFWoRs,2017-11-14,Jason Momoa & Lisa Bonet: Love at First Sight,The Late Late Show with James Corden,Entertainment,2017-11-10 09:35:00,1497519,15504,353,1084,False,False,False
79,AJYb0Yom5UQ,2017-11-14,Howard Stern: George Takei Talks About Harvey Weinstein and Sexually Assault,cocheusadoooo,Comedy,2017-10-17 20:01:44,148226,355,47,178,False,False,False
80,gLswXiRLdkA,2017-11-14,A VERY #EXTRA EBAY SHOPPING HAUL!,Amber Scholl,Howto & Style,2017-11-11 02:42:23,484185,23296,1184,1858,False,False,False
81,MyEqfBkzESU,2017-11-14,EXTREME GOLDEN TAN TRANSFORMATION,John Maclean,Howto & Style,2017-11-10 20:40:44,300617,8133,2693,2911,False,False,False
82,wJYE0sFOteE,2017-11-14,Inside the Cheese-Aging Caves 30 Feet Under Brooklyn | I Got a Guy | Bon Appétit,Bon Appétit,Howto & Style,2017-11-10 16:01:04,92523,2323,40,134,False,False,False
83,L_5_slz4ke4,2017-11-14,Some NFL players call for an end to Thursday night football after 8 players were injured last week,ABC News,News & Politics,2017-11-12 20:26:46,7524,67,19,56,False,False,False
84,OKoL852K9uA,2017-11-14,ICE PRIMER? DOES IT WORK?!,mayratouchofglam,Howto & Style,2017-11-11 05:23:36,103927,3571,278,399,False,False,False
85,pa_oUisZZy0,2017-11-14,Mark Ruffalo Reads Hilarious Thirst Tweets,BuzzFeed Celeb,People & Blogs,2017-11-11 00:30:16,177707,6271,88,275,False,False,False
86,fNtLIcyjsnI,2017-11-14,"Game Night Official Trailer #1 (2018) Rachel McAdams, Jason Bateman Comedy Movie HD",Zero Media,Film & Animation,2017-11-09 17:11:32,1751064,16430,945,1231,False,False,False
87,_Iz83-Cmt6A,2017-11-14,Little Big Town with Jimmy Webb - Wichita Lineman (Live from the CMA Awards),CMAVEVO,Music,2017-11-09 22:23:51,46746,439,66,55,False,False,False
88,YlvCVbfS9M0,2017-11-14,Alan Walker - All Falls Down (Behind The Scenes),Alan Walker,Music,2017-11-11 15:11:18,746092,34839,537,2541,False,False,False
89,arJ5h2TY3I4,2017-11-14,FANTASY (feat. Amber Liu) by SUPERFRUIT,SUPERFRUIT,Entertainment,2017-11-10 17:00:51,836830,82320,1279,7998,False,False,False
90,-2RVw2_QyxQ,2017-11-14,2017 Champions Showdown: Day 3,Saint Louis Chess Club,Education,2017-11-12 02:39:01,67429,438,23,23,False,False,False
91,gEHCXl4J9Qo,2017-11-14,Taylor Swift - “New Year’s Day” Fan Performance,ABC Television Network,Entertainment,2017-11-10 02:32:15,2237404,72593,1830,3501,False,False,False
92,-OK9i1_YYYc,2017-11-14,Animal Adventure Park Giraffe Cam,Animal Adventure Park,Pets & Animals,2017-11-12 00:18:43,45455,2282,35,17,False,False,False
93,b4vTZx_AtHk,2017-11-14,How To Dry a Shirt in 30 Seconds,HowToBasic,Howto & Style,2017-11-09 18:36:48,2063667,98804,11682,11443,False,False,False
94,kOnQocd799Y,2017-11-14,Everything Wrong With Baby Driver In 14 Minutes Or Less,CinemaSins,Film & Animation,2017-11-09 17:14:11,2736733,58967,3492,7915,False,False,False
95,e4FApt6z55c,2017-11-14,Kimbra - Top of the World (Official Music Video),kimbramusic,Music,2017-11-10 15:43:00,165698,8599,361,930,False,False,False
96,2XK4omx9uMU,2017-11-14,Camila Cabello COMPLETELY NAILS 'Finish The Lyric',Capital FM,Music,2017-11-10 14:40:32,836544,40195,373,976,False,False,False
97,xfmipNU4Odc,2017-11-14,Edna's registered owner thought she was dead for 2 years!!!,Hope For Paws - Official Rescue Channel,Pets & Animals,2017-11-10 18:02:04,284666,16396,81,949,False,False,False
98,jp9hK-jY6yY,2017-11-14,When Someone Has A Crush on You | Lilly Singh,IISuperwomanII,Comedy,2017-11-09 22:21:13,3371669,202676,3394,20086,False,False,False
99,RkHuWjiR-LM,2017-11-14,Neck Deep - Parachute (Official Music Video),Hopeless Records,Music,2017-11-10 18:03:54,195685,14338,171,1070,False,False,False
100,fCTKDn3Q8xQ,2017-11-14,Idiot's Guide to Japanese Squat Toilets,Rachel and Jun,People & Blogs,2017-11-09 11:24:14,1098897,43875,1326,4702,False,False,False
101,DIU3xPdhCBI,2017-11-14,Sam Smith surprises brides at their wedding! (At The BBC),BBC Music,Music,2017-11-09 22:26:10,893462,22326,833,943,False,False,False
102,wnwF1FHybDQ,2017-11-14,Mark Wahlberg's Kids Use Him for His Celeb Connections,Late Night with Seth Meyers,Comedy,2017-11-10 11:00:04,225286,1731,193,206,False,False,False
103,9oFP-pOMNwE,2017-11-14,H&M Holiday 2017 starring Nicki Minaj – official teaser,H&M,Entertainment,2017-11-09 08:01:40,264793,3283,853,0,True,False,False
104,pz95u3UVpaM,2017-11-14,Camila Cabello - Havana (Vertical Video) ft. Young Thug,CamilaCabelloVEVO,Music,2017-11-10 05:01:00,5476737,286268,4083,12254,False,False,False
105,g5c1bk8weaQ,2017-11-14,FIRST TIME IM DOING THIS! TALKS WITH LIZA.,Liza Koshy,Comedy,2017-11-10 03:43:43,3578502,307435,2573,12248,False,False,False
106,yuBqWcSKrCk,2017-11-14,"Owen Wilson on Meeting Julia Roberts, and Tandem Biking",TheEllenShow,Entertainment,2017-11-10 14:00:10,304926,3305,130,275,False,False,False
107,x9mh-SwSKas,2017-11-14,Surprise After Surprise | October Vlog,clothesencounters,Howto & Style,2017-11-10 18:42:55,247319,10138,153,639,False,False,False
108,uiA4B5Y63IQ,2017-11-14,THE SHAPE OF WATER - Final Trailer,FoxSearchlight,Film & Animation,2017-11-09 22:00:07,296434,3327,142,377,False,False,False
109,viyRD5z6ilQ,2017-11-14,Luke Bryan - O Holy Night (Audio),LukeBryanVEVO,Music,2017-11-10 05:00:01,125962,5048,139,369,False,False,False
110,QFfEtKvXMAs,2017-11-14,Niall Horan - Too Much To Ask (Acoustic),NiallHoranVEVO,Music,2017-11-10 17:00:05,419341,53572,168,3083,False,False,False
111,xg9ebVTL9yE,2017-11-14,Empire Of The Sun - Way To Go,empireofthesunvevo,Music,2017-11-10 05:00:06,138988,7999,84,612,False,False,False
112,fbHbTBP_u7U,2017-11-14,NF - Let You Down,NFVEVO,Music,2017-11-09 05:00:05,1774018,88417,1002,7686,False,False,False
113,Ja_GMU7-sjs,2017-11-14,Google Pixelbook: $1000 of Weird!,Marques Brownlee,Science & Technology,2017-11-09 21:18:33,1575525,52829,1524,5864,False,False,False
114,QOksZ8VogRw,2017-11-14,Bastille - World Gone Mad (from Bright: The Album) [Official Music Video],Atlantic Records,Music,2017-11-09 17:03:42,626688,25115,499,1392,False,False,False
115,RYs08kX3Ih4,2017-11-14,SECRETS REVEALED! HOW I LAY MY LACE WIGS! | AALIYAHJAY,MsAaliyahJay,Howto & Style,2017-11-10 01:30:00,219030,14303,398,1099,False,False,False
116,tOFkFZbPdnQ,2017-11-14,Typical audience reaction to a bass solo...,Danny Sapko,Music,2017-11-09 00:44:51,493662,7693,181,388,False,False,False
117,dW4wpGg64pE,2017-11-14,Meryl Streep Meets Anna Wintour at Vogue,Vogue,Entertainment,2017-11-09 18:20:27,1017803,25122,628,1504,False,False,False
118,2VP846QcA_4,2017-11-14,I Trained To Become Batman 🦇 (Justice League),Michelle Khare,Entertainment,2017-11-09 11:30:00,139955,4417,217,457,False,False,False
119,_dhneCO4YEE,2017-11-14,"Russian Bots and Trolls | November 8, 2017 Act 2 | Full Frontal on TBS",Full Frontal with Samantha Bee,People & Blogs,2017-11-09 07:00:01,362009,5505,2356,1264,False,False,False
120,EYkEshCOhEU,2017-11-14,The Ultimate Red Lip Look | Nicole Guerriero,Nicole Guerriero,People & Blogs,2017-11-10 00:24:29,294387,15247,385,976,False,False,False
121,Rq9-mW6HgQE,2017-11-14,Sean Astin Knew Nothing About 'Lord Of The Rings' Once Upon A Time,The Late Show with Stephen Colbert,Entertainment,2017-11-09 08:35:00,844653,11616,313,1518,False,False,False
122,k29YnfttqEU,2017-11-14,Mean Tweets – Country Music Edition #3,Jimmy Kimmel Live,Comedy,2017-11-09 04:58:04,1315873,9312,584,769,False,False,False
123,Eg_kW5fw6qU,2017-11-14,Could Anastasia Become A Disney Princess?,SuperCarlinBrothers,People & Blogs,2017-11-09 23:27:18,188003,9091,135,2814,False,False,False
124,J_QGZspO4gg,2017-11-14,Sia - Snowman,SiaVEVO,Music,2017-11-09 15:45:05,1624771,84426,1130,5981,False,False,False
125,PkRBTF6nt4E,2017-11-14,Tesla's biggest problem is one nobody saw coming,Business Insider,News & Politics,2017-11-10 13:00:02,125970,935,507,262,False,False,False
126,ozkqm2ifMw8,2017-11-14,2CELLOS - Cinema Paradiso [OFFICIAL VIDEO],2CELLOS,Music,2017-11-10 13:24:10,205869,11198,120,446,False,False,False
127,htvR_dBs3eg,2017-11-14,Sam Smith - The Thrill of It All ALBUM REVIEW,theneedledrop,Music,2017-11-10 21:38:57,98422,2926,106,798,False,False,False
128,qEEtzzi1EII,2017-11-14,Birthdays - Simon's Cat | GUIDE TO,Simon's Cat,Pets & Animals,2017-11-09 13:34:58,426078,19323,245,945,False,False,False
129,1Wk8ZRgXQnY,2017-11-14,Andy Grammer - The Good Parts (Official Audio),Andy Grammer,Music,2017-11-09 22:27:45,33315,1365,24,91,False,False,False
130,8l_e6bx8UG8,2017-11-14,Remy Ma - Wake Me Up (Audio) ft. Lil' Kim,RemyMaVEVO,Music,2017-11-08 17:00:00,1231518,32648,6221,9288,False,False,False
131,lsfzA7sWlOM,2017-11-14,L.A. Noire - Nintendo Switch Trailer,Nintendo,Gaming,2017-11-09 19:59:48,154872,7683,164,1734,False,False,False
132,RQDphL2MVlM,2017-11-14,Everything I Wore This Week! Outfit Diary 1,Dina Tokio,Howto & Style,2017-11-10 22:22:04,72626,3652,120,219,False,False,False
133,X7flefV8tec,2017-11-14,"President Bill Clinton On Dictators, Democracy, & Why We Need Immigrants More Than Ever",Team Coco,Entertainment,2017-11-09 02:37:49,366180,4364,4448,1997,False,False,False
134,cYw-oyJ7AEY,2017-11-14,"Pitbull, Stereotypes - Jungle (Lyric Video) ft. E-40, Abraham Mateo",PitbullVEVO,Music,2017-11-10 08:00:01,264511,11736,532,743,False,False,False
135,6nJw-jPQYVI,2017-11-14,A Day in The Life of David Letterman,Late Show with David Letterman,Entertainment,2015-05-21 07:55:00,192609,1345,24,126,False,False,False
136,5x1FAiIq_pQ,2017-11-14,Alicia Keys - When You Were Gone,Alicia Keys,Music,2017-11-09 15:49:21,95944,1354,181,117,False,False,False
137,LMCuKltaY3M,2017-11-14,Elbow - Golden Slumbers (John Lewis Advert 2017),ElbowVEVO,Music,2017-11-10 08:00:01,154494,2163,147,211,False,False,False
138,6Detw08jRhs,2017-11-14,MDNA SKIN: Express Yourself,MDNA SKIN,People & Blogs,2017-11-09 18:24:34,53321,443,131,106,False,False,False
139,vd4zwINEcLY,2017-11-14,Live in the now!,poofables,Entertainment,2011-03-27 04:31:25,95085,909,52,193,False,False,False
140,7fm7mll2qvg,2017-11-14,Sigrid - Strangers (Lyric Video),SigridVEVO,Music,2017-11-10 00:00:00,91776,4604,46,357,False,False,False
141,5gFpcEKayz4,2017-11-14,MØ - When I Was Young (Official Video),MOMOMOYOUTHVEVO,Music,2017-11-09 09:00:00,764716,35765,483,1159,False,False,False
142,eHIY3HNNqzM,2017-11-14,The Script - Arms Open (Acoustic) [Audio],TheScriptVEVO,Music,2017-11-10 08:00:03,135337,7158,89,318,False,False,False
143,q-WipZ9p0wk,2017-11-14,Three meals that cost me $1.50 each,Brothers Green Eats,Howto & Style,2017-11-09 14:00:08,77630,1991,83,208,False,False,False
144,zy0b9e40tK8,2017-11-14,Dark | Official Trailer [HD] | Netflix,Netflix,Entertainment,2017-11-09 09:00:07,378750,5642,146,675,False,False,False
145,rL4WkebTT_U,2017-11-14,Where is TOKYO'S GREATEST View?,Abroad in Japan,Entertainment,2017-11-09 15:06:34,151709,9210,71,1103,False,False,False
146,Y6eKxjMA9ek,2017-11-14,"Dropping And CATCHING A Paper Airplane At 2,000 Feet!",Tucker Gott,Entertainment,2017-11-09 16:00:09,175852,15909,200,852,False,False,False
147,Q6Usd3_fbq8,2017-11-14,Improvising in the style of different classical composers | Practice Notes 34,Nahre Sol,Music,2017-11-10 04:08:31,5149,242,0,54,False,False,False
148,44NYFvhXmW8,2017-11-14,Thirty Seconds To Mars - Walk On Water (Official Music Video),ThirtySecondsToMarsVEVO,Music,2017-11-08 13:00:00,1905487,65854,2442,4490,False,False,False
149,9wg3v-01yKQ,2017-11-14,Harry Styles - Kiwi,HarryStylesVEVO,Music,2017-11-08 13:00:01,9632678,810895,16139,59473,False,False,False
150,F-j_6IuaYfw,2017-11-14,I Miss the Old Taylor,Wong Fu Productions,Entertainment,2017-11-08 21:05:20,476389,16106,950,2077,False,False,False
151,_qSW96a2aKY,2017-11-14,Keith Urban - Female (Official Audio),Keith Urban,Entertainment,2017-11-08 05:01:25,754558,11985,1356,1757,False,False,False
152,afgvlR9WmIQ,2017-11-14,Maroon 5 - What Lovers Do (Live On The Ellen DeGeneres Show/2017),Maroon5VEVO,Music,2017-11-09 02:21:31,762616,20159,336,899,False,False,False
153,_CJN_ryETIY,2017-11-14,Harry Styles canta Sign Of The Times a X Factor Italia - Live Show 3,X Factor Italia,Entertainment,2017-11-09 23:59:08,199429,10175,66,539,False,False,False
154,P4YJwy_T9pM,2017-11-14,I Picked My Girlfriend's Outfit Blindfolded,Tyler Williams,People & Blogs,2017-11-09 03:16:36,691229,31892,197,1404,False,False,False
155,YqH4eWR7jDQ,2017-11-14,"The Oak Beams of New College, Oxford",Stewart Brand,Education,2012-06-10 19:24:38,6412,49,0,2,False,False,False
156,r96KpNTcog4,2017-11-14,THE MOMENTS BETWEEN THE MONTAGE | Chris & Jack,Chris and Jack,Comedy,2017-11-09 14:00:17,108618,4989,58,274,False,False,False
157,B4gXsobd_ao,2017-11-14,What Are Diminutives – and Why We Like Them,The School of Life,Education,2017-11-09 14:00:01,79306,3809,127,670,False,False,False
158,x8eLIJAM58M,2017-11-14,KUWTK | Scott Gets Upset Over Being Uninvited to Khloe K.'s Party | E!,E! Entertainment,Entertainment,2017-11-08 14:00:05,812007,5894,951,851,False,False,False
159,6V_aZsATDsM,2017-11-14,"Chapter 28: I Love My Baby But, I Miss My Dad",Whitney Port,Howto & Style,2017-11-09 17:22:40,55398,1170,22,336,False,False,False
