dataid,video_id,trending_date,title,channel_title,category_id,publish_time,views,likes,dislikes,comment_count,comments_disabled,ratings_disabled,video_error_or_removed
4111,ZfHiw_LFNGw,2017-12-04,Kylie Jenner Pregnancy Reveal On Keeping Up With The Kardashians,HollywoodLife,Entertainment,2017-11-29 00:35:32,4509368,20797,6749,2994,False,False,False
4112,GDUncuEErzQ,2017-12-04,How the Atomic Age Began at UChicago,The University of Chicago,Education,2012-12-10 17:48:48,7188,29,2,2,False,False,False
4113,Zx7p_tmWlq0,2017-12-04,"White House Press Briefing - November 30, 2017 | NBC News",NBC News,News & Politics,2017-11-30 20:41:21,13755,72,36,0,True,False,False
4114,pJ96Z2PPKI8,2017-12-04,The Voice 2017 - Team Miley: Man! I Feel Like a Woman,The Voice,Entertainment,2017-11-29 02:10:41,1170099,21873,898,1434,False,False,False
4115,ykHeGtN4m94,2017-12-04,"Love, Simon | Official Trailer [HD] | 20th Century FOX",20th Century Fox,Film & Animation,2017-11-28 21:28:53,2836046,70248,3115,5766,False,False,False
4116,pWZnhJay0Y8,2017-12-04,Disney's Live Action Mulan - Liu Yifei aka Crystal Liu Cast - REACTION,Beyond The Trailer,Entertainment,2017-11-29 18:53:21,129917,2409,548,1200,False,False,False
4117,0MyCrMrkMFo,2017-12-04,I Became My Sim For A Day *CHALLENGE*,Millie T,Entertainment,2017-11-30 18:00:00,312273,16263,413,714,False,False,False
4118,0nybdPCuvRI,2017-12-04,LeBron James ejected for first time in career | ESPN,ESPN,Sports,2017-11-29 02:16:58,700096,3202,271,1279,False,False,False
4119,gvZW4Lh-8Mc,2017-12-04,First Time Seeing Daddy Without a Beard!,cgriesemer,Film & Animation,2017-11-29 14:58:15,43279,154,8,33,False,False,False
4120,2nJ3U5dzvPs,2017-12-04,HANSON - Finally It's Christmas (Official Music Video),HANSON,Music,2017-11-30 17:04:50,82043,2175,85,235,False,False,False
4121,J2kNt-PHayo,2017-12-04,Winter BEAUTY HAUL | Fleur De Force,Fleur DeForce,Howto & Style,2017-11-29 17:00:02,123944,4106,89,295,False,False,False
4122,oeAEuiovVbg,2017-12-04,Drop the Mic: Michael Bennett vs Vanessa Hudgens - FULL BATTLE | TBS,TBS,Entertainment,2017-11-28 20:30:42,1006575,20632,225,1231,False,False,False
4123,VhexfxLPgTE,2017-12-04,See you in Russia!,FIFATV,Sports,2017-11-30 07:30:00,283781,7811,84,1213,False,False,False
4124,6d6SmcYcP_U,2017-12-04,Twitter Is FURIOUS VS Fashion Show Aired Model's Runway Fall UNEDITED,Clevver News,Entertainment,2017-11-29 23:30:19,352497,3220,161,515,False,False,False
4125,Z9cB0TjfIkM,2017-12-04,Honest Trailers - The Room,Screen Junkies,Film & Animation,2017-11-28 18:00:02,2057589,60503,1022,5283,False,False,False
4126,a8gzChJsvEo,2017-12-04,Everything Wrong With Arrival In 16 Minutes Or Less,CinemaSins,Film & Animation,2017-11-28 17:11:19,1760535,38134,3278,6589,False,False,False
4127,NqntFonA2iY,2017-12-04,Jennifer Lawrence: 'I Become Incredibly Rude' to Avoid Fan Encounters in Public,Variety,Entertainment,2017-11-28 19:26:57,638979,2964,7613,3317,False,False,False
4128,y7QjFRtt-sg,2017-12-04,BOYFRIEND TAG w Travelaine | Madelaine Petsch,Madelaine Petsch,People & Blogs,2017-11-29 19:49:56,260042,23149,129,1044,False,False,False
4129,J3IbiFCR-Xs,2017-12-04,Josh Gordon - I'm Coming Home,Vote The Process,Film & Animation,2017-11-30 01:29:36,88257,590,26,54,False,False,False
4130,sQi0Yu1ApyE,2017-12-04,KUWTK | Kendall Jenner & Khloe Kardashian Consider Getting a Gun | E!,E! Entertainment,Entertainment,2017-11-29 15:00:06,859196,7215,345,747,False,False,False
4131,f2xPEy4PrmA,2017-12-04,Tortoise Chases Cat - 977359-7,RM Videos,Comedy,2017-11-29 18:09:02,36684,146,4,8,False,False,False
4132,4qakFfGRV4E,2017-12-04,"#23 Feed The Homeless | One List, One Life","One List , One Life",People & Blogs,2017-11-30 15:36:12,41742,707,86,112,False,False,False
4133,ggpoZyF2lU0,2017-12-04,Adriana Lima’s Victoria’s Secret Sleepover | Vogue,Vogue,Entertainment,2017-11-29 15:35:01,674279,18674,509,617,False,False,False
4134,qEklBC2BQig,2017-12-04,Joe Keery Swings By To Talk About Stranger Things 2,BUILD Series,Entertainment,2017-11-29 18:31:44,88463,2725,29,264,False,False,False
4135,8bKKVuZA0ys,2017-12-04,I Got Transformed Into JLo | Beauty Evolution | Refinery29,Refinery29,Howto & Style,2017-11-30 16:00:00,27945,736,33,97,False,False,False
4136,d8GHT9nK66Y,2017-12-04,Kane Brown - Found You,KaneBrownVEVO,Music,2017-11-28 08:00:05,725461,14659,634,398,False,False,False
4137,LYX7CnSiBSM,2017-12-04,5 Desserts To Share with your BFF at Max Brenner Chocolate Bar,Tasty,People & Blogs,2017-11-29 02:00:03,328143,13944,229,749,False,False,False
4138,5MtBgDVPtx0,2017-12-04,STAR WARS in Public,RackaRacka,Entertainment,2017-11-28 16:36:59,1133142,87399,837,6612,False,False,False
4139,7uvxjNut1gk,2017-12-04,QUARTZ – The World's First Self-Cleaning Water Bottle,QUARTZ,People & Blogs,2017-11-07 07:09:01,65409,33,9,0,True,False,False
4140,k9oMv0JzCn8,2017-12-04,Cardi B | MOBO Awards 2017 | Live Performance,MOBO Awards,Music,2017-11-29 23:23:09,34390,365,24,50,False,False,False
4141,fy5hua8oEVQ,2017-12-04,"Barry & Iris Married, Oliver & Felicity Married | Crisis on Earth X Final Ending",NitroV2,Film & Animation,2017-11-29 03:19:58,131803,1483,108,568,False,False,False
4142,3XklsSF53pc,2017-12-04,How-To Make a Steak Sandwich with Matty Matheson,Munchies,Entertainment,2017-11-28 12:00:00,886543,22691,601,1855,False,False,False
4143,Q9B45wXYpzc,2017-12-04,Television icon Jim Nabors has passed away,USA TODAY,News & Politics,2017-11-30 20:05:10,4874,46,1,61,False,False,False
4144,ljEjBIZ2qCQ,2017-12-04,Let's Talk about Money,vlogbrothers,People & Blogs,2017-11-28 19:22:55,311054,12395,373,1592,False,False,False
4145,o9zRQijCN5w,2017-12-04,Logic & Rag'n'Bone Man - Broken People (from Bright: The Album) [Official Audio],Atlantic Records,Music,2017-11-29 05:08:34,539602,25609,319,1099,False,False,False
4146,-v-_Z11T5L4,2017-12-04,"A social worker has the worst day of his life. Then, a homeless man shows him what 'bad' really is.",Omeleto,Film & Animation,2017-11-29 08:57:21,78612,2456,63,151,False,False,False
4147,nVrkQyLS4oE,2017-12-04,90's Toy Mystery Box (ft. Joe Sugg),Tyler Oakley,Entertainment,2017-11-28 20:01:26,373314,27724,356,1487,False,False,False
4148,lyavSkF30Rs,2017-12-04,Ashanti Speaks on Irv Gotti and Murder Inc | Everyday Struggle,Complex,Entertainment,2017-11-29 19:00:02,53817,437,25,174,False,False,False
4149,wa9ZyarpM2U,2017-12-04,TEENS READ 10 FUNNY FRIEND ZONE TEXTS (REACT),REACT,Entertainment,2017-11-27 20:00:09,1515846,34793,1553,3128,False,False,False
4150,ri1m5j_yq8A,2017-12-04,Prince William: Wedding means Harry will stop raiding my fridge!,The Royal Family Channel,News & Politics,2017-11-29 17:17:32,237467,1631,59,294,False,False,False
4151,CXK3OiDgymo,2017-12-04,Behind the Scenes at the Victoria's Secret Fashion Show | Vlog | Karlie Kloss,Klossy,People & Blogs,2017-11-29 00:07:39,732629,26235,275,804,False,False,False
4152,THr_seahKUI,2017-12-04,2017 Christmas Decorations at the White House,The White House,News & Politics,2017-11-27 14:17:59,2118097,34016,24186,19071,False,False,False
4153,1vc1cKeor5A,2017-12-04,COCO Movie Review... and Olaf's Frozen Adventure | Andre Black Nerd,Andre Black Nerd,Film & Animation,2017-11-28 23:54:33,67561,3039,60,631,False,False,False
4154,_KEN-cxmGw8,2017-12-04,What Jeremy Clarkson thinks about Tesla,Mashable Daily,Autos & Vehicles,2017-11-28 19:27:30,993022,9038,1176,2514,False,False,False
4155,TNRrY8m71u4,2017-12-04,POOL OF SQUISHIES - Japan Vlog,TiffyQuake,Howto & Style,2017-11-29 03:23:43,81968,3293,38,519,False,False,False
4156,Ah7ldw_WmtE,2017-12-04,Green Light - Cyanide & Happiness Minis,ExplosmEntertainment,Comedy,2017-11-28 06:00:00,636739,33199,570,1478,False,False,False
4157,4SvJgnhnUag,2017-12-04,Free Fall Ride In Denmark,INSIDER,Howto & Style,2017-11-30 16:37:38,20102,538,1,82,False,False,False
4158,mGAdg2lB6nQ,2017-12-04,Poppy “Moshi Moshi” Official Lyrics & Meaning | Verified,Genius,Music,2017-11-29 18:11:47,113345,3509,1617,1028,False,False,False
4159,3MA_64gyaA0,2017-12-04,Pancakes Recipe | Quick and Easy Pancakes by Grandpa for Orphan Kids,Grandpa Kitchen,Howto & Style,2017-11-28 20:44:06,574266,19361,440,2215,False,False,False
4160,q9bGAAYR2MY,2017-12-04,WHAT MY $1100 LA STUDIO LOOKS LIKE,DamonAndJo,Comedy,2017-11-28 20:22:30,120015,5645,238,474,False,False,False
4161,exYLX9xGoyo,2017-12-04,PRINCESS PEACH CAKE - SUPER MARIO - NERDY NUMMIES,Rosanna Pansino,Howto & Style,2017-11-28 14:58:28,632190,29942,274,5196,False,False,False
4162,xe8Id7pDNOM,2017-12-04,Anti-Soggy Cereal Spoon,William Osman,Science & Technology,2017-11-28 14:00:04,316549,12147,253,2914,False,False,False
4163,CVPp5FtQN8E,2017-12-04,Disney Princess Hand Pies,Pies Are Awesome,Howto & Style,2017-11-30 00:54:50,1776,17,0,5,False,False,False
4164,QgaYsdnOMiM,2017-12-04,How To Make A GIANT CANDY CANE Cake w. SURPRISE INSIDE | PEPPERMINT MOCHA | How To Cake It,How To Cake It,Howto & Style,2017-11-28 16:00:38,626364,25293,307,2552,False,False,False
4165,Tn5OBFgiExQ,2017-12-04,Joe Rogan and Eddie Bravo on Bob Sapp vs Nogueira (Part 1 of 2),razzark666,Entertainment,2012-01-02 23:42:16,51984,215,8,31,False,False,False
4166,BGtsTNCMrQI,2017-12-04,Test footage of my raspberry pi camera in the dark,Facelesstech,Gaming,2017-11-25 19:26:31,1315,2,0,3,False,False,False
4167,LqF3QRp3VCE,2017-12-04,Daisy Ridley talks about spending time with Carrie Fisher on the set of 'The Force Awakens',Good Morning America,Entertainment,2017-11-28 15:34:06,419243,6293,241,1299,False,False,False
4168,UXm1xHECZu0,2017-12-04,This Week I Learned to Saber a Champagne Bottle,Mike Boyd,Entertainment,2017-11-28 13:18:25,406960,27175,150,2350,False,False,False
4169,8rWuGBPA7bE,2017-12-04,Impatient Dog Honks Horn for Owner's Attention || ViralHog,ViralHog,Pets & Animals,2017-11-27 20:42:13,543639,5370,132,390,False,False,False
4170,xegUPsJaUKc,2017-12-04,WE MADE A JEWELRY LINE // Grace Helbig,Grace Helbig,People & Blogs,2017-11-29 18:00:05,111793,7396,108,435,False,False,False
4171,5qxqo2CQakA,2017-12-04,EVERY STAR WARS FAN EVER,Smosh,Comedy,2017-11-27 17:00:00,1374287,33295,8300,3036,False,False,False
4172,W8_T7MMywcs,2017-12-04,Honest Trailer Commentaries - The Room,ScreenJunkies News,Entertainment,2017-11-28 18:37:33,62622,1769,45,257,False,False,False
4173,LQicq60aJaw,2017-12-04,FULL Interview: Prince Harry and Meghan Markle  - BBC News,BBC News,News & Politics,2017-11-27 19:38:39,1184049,8497,981,3863,False,False,False
4174,hYip_Vuv8J0,2017-12-04,Blockchain Expert Explains One Concept in 5 Levels of Difficulty | WIRED,WIRED,Science & Technology,2017-11-28 17:00:30,148038,5183,279,788,False,False,False
4175,dQLlS4l1UJk,2017-12-04,Galantis & Throttle - Tell Me You Love Me (Official Music Video),Galantis,Music,2017-11-28 15:00:58,338590,16988,247,900,False,False,False
4176,UqItlHUSN-4,2017-12-04,[OFFICIAL VIDEO] Deck The Halls - Pentatonix,PTXofficial,Music,2017-11-27 15:00:54,3260376,115637,3474,10634,False,False,False
4177,uZ1M3DkKCEI,2017-12-04,"Pitbull, Fifth Harmony - Por Favor (Official Video)",PitbullVEVO,Music,2017-11-27 14:00:43,6374457,202600,10689,14356,False,False,False
4178,p7E8g-Ity0k,2017-12-04,IGNITION 2017 LIVE - Day Two: Morning Session,Business Insider,News & Politics,2017-11-30 17:41:07,3842,67,11,3,False,False,False
4179,IbVR4kzVQrk,2017-12-04,John Mayer And Nicki Minaj’s Twitter Flirting | WWHL,Watch What Happens Live with Andy Cohen,Entertainment,2017-11-28 04:59:58,114696,731,130,162,False,False,False
4180,pDi7cezk9CA,2017-12-04,COMING OUT (ELLE MILLS STYLE),ElleOfTheMills,Entertainment,2017-11-27 21:00:01,1232041,164617,2998,22630,False,False,False
4181,JdrdNQfZoqs,2017-12-04,Skelly the Skeleton Robot wishing you a Merry Christmas & Happy New Year,Skelly Robot,People & Blogs,2017-11-23 16:11:09,4767,90,1,4,False,False,False
4182,L34y5NGMQBY,2017-12-04,'Riverdale' Season 2: Josie Takes Center Stage In The Upcoming 3 Part Episode | Sweetwater Secrets,Entertainment Tonight,Entertainment,2017-11-29 20:00:04,11661,477,11,109,False,False,False
4183,NyNtWpDnT0Y,2017-12-04,Peter Bone to Trump: Delete Your Account,Ross Kempsell,Comedy,2017-11-30 11:40:37,3052,7,39,0,True,False,False
4184,lRdsL1z7Ml4,2017-12-04,Saoirse Ronan Tries to Pronounce Difficult Celeb Names,POPSUGAR,Howto & Style,2017-11-27 19:56:40,344534,4511,40,433,False,False,False
4185,UVaeRX9LybU,2017-12-04,PREGNANCY ANNOUNCEMENT After Two Miscarriages | Our Baby Has A Heart Beat! 👶🏼,Ellie and Jared,People & Blogs,2017-11-27 17:42:18,1161776,60228,1976,11940,False,False,False
4186,lQ9EpoaNQRc,2017-12-04,Timothée Chalamet's first time meeting Andy Cohen,SiriusXM,News & Politics,2017-11-28 16:25:07,49017,375,1,38,False,False,False
4187,sw7RElt-SvE,2017-12-04,PADDINGTON 2 - Full US Trailer,Warner Bros. Pictures,Entertainment,2017-11-28 17:00:03,110360,2054,94,198,False,False,False
4188,Fjm81OPZbpU,2017-12-04,"Miguel - Come Through and Chill (Audio) ft. J. Cole, Salaam Remi",MiguelVEVO,Music,2017-11-27 05:00:00,955104,32845,425,1728,False,False,False
4189,EP5ExDvQ3p4,2017-12-04,Avengers 4: Who Will Die? - Movie Talk,ColliderVideos,Entertainment,2017-11-28 18:23:34,76956,2269,108,736,False,False,False
4190,NKin_i1pcFA,2017-12-04,"The Spyker C8 Is the Quirkiest $250,000 Exotic Car in History",Doug DeMuro,Autos & Vehicles,2017-11-27 17:00:48,1457307,29851,1032,7918,False,False,False
4191,piyds9slayg,2017-12-04,Nichola Joss's Top 3 Facial Massage Techniques | SUPERSTARS | Feelunique,Feelunique,Howto & Style,2017-03-28 11:13:26,19976,174,4,8,False,False,False
4192,e5IRkF20JmU,2017-12-04,REACTING to BTS Mic Drop! (MV),Wassabi Productions,Entertainment,2017-11-27 23:00:02,478259,27027,531,10424,False,False,False
4193,w2A8q3XIhu0,2017-12-04,Why Hold Music Sounds Worse Now,Tom Scott,Education,2017-11-27 16:00:04,556475,23837,275,1322,False,False,False
4194,aliDVYH08pg,2017-12-04,What do cats want for Christmas? - Simon's Cat | LOGIC,Simon's Cat,Pets & Animals,2017-11-28 15:31:49,239592,7742,203,436,False,False,False
4195,6tiphMs-dCY,2017-12-04,Finding a Boyfriend for the Holidays | Hannah Stocking,Hannah Stocking,Comedy,2017-11-27 18:00:04,1970963,68401,1793,2334,False,False,False
4196,XAzqBDFs418,2017-12-04,Battle with Charlie Puth | Rudy Mancuso,Rudy Mancuso,Comedy,2017-11-27 21:17:31,1752883,137210,1198,6341,False,False,False
4197,4iN6uiOsCr0,2017-12-04,MEGA JAM DAY,ANDREW HUANG,Music,2017-11-28 20:02:18,96082,5724,42,3117,False,False,False
4198,Em8C6AvD4sk,2017-12-04,Los Angeles’s Dangerous Obsession with Car Chases | The New Yorker,The New Yorker,Entertainment,2017-11-28 17:00:29,54141,491,49,79,False,False,False
4199,2omJBSQcm5g,2017-12-04,A Magical Holiday,H&M,Entertainment,2017-11-28 06:59:15,534291,4993,181,0,True,False,False
4200,SxAp27sFaIM,2017-12-05,Lil Uzi Vert - The Way Life Goes Remix (Feat. Nicki Minaj) [Official Music Video],LIL UZI VERT,People & Blogs,2017-12-04 22:42:37,682894,60206,1779,11887,False,False,False
4201,266EI7hdjFs,2017-12-05,Jurassic World: Fallen Kingdom - Trailer Thursday (Run) (HD),Universal Pictures,Entertainment,2017-12-04 00:41:00,2693367,32785,3051,7478,False,False,False
4202,c3BTGJgd8Wo,2017-12-05,"Ashanti Talks Murda Inc, Relationships, New Music + More",Breakfast Club Power 105.1 FM,Entertainment,2017-12-04 13:31:15,307242,4536,520,2341,False,False,False
4203,me5ifeBFaFo,2017-12-05,Thomas Train Stunts,5MadMovieMakers,Entertainment,2017-12-04 19:22:01,481783,18336,188,997,False,False,False
4204,-C5q3oir8gA,2017-12-05,Will It Christmas Tree?,Good Mythical Morning,Entertainment,2017-12-04 11:00:00,497085,13960,608,1842,False,False,False
4205,_9YMpuLDnwo,2017-12-05,42 HOLY GRAIL HACKS THAT WILL SAVE YOU A FORTUNE,5-Minute Crafts,Howto & Style,2017-12-03 08:30:00,10883016,100508,21627,11382,False,False,False
4206,X6iJ0hPpGec,2017-12-05,Learn to Break a Glass with Your Voice || Learn Quick,Mike Boyd,Entertainment,2017-12-04 12:00:03,539605,30432,280,2819,False,False,False
4207,xl3HhY2BTuU,2017-12-05,Eagles vs. Seahawks | NFL Week 13 Game Highlights,NFL,Sports,2017-12-04 04:55:56,1270477,12058,620,6865,False,False,False
4208,sjN-NGsRg9g,2017-12-05,Crawling (One More Light Live) - Linkin Park,Linkin Park,Music,2017-12-04 15:00:48,523885,73680,286,6354,False,False,False
4209,Z2Y8jGrkrDc,2017-12-05,The Invention Of Chapstick,Gus Johnson,Comedy,2017-12-03 14:48:37,389207,13401,1001,930,False,False,False
4210,sW5HaEsnuMI,2017-12-05,8 Water Bottle Gadgets from GearBest,CrazyRussianHacker,Science & Technology,2017-12-03 19:01:09,1002937,24828,1239,3627,False,False,False
4211,1l26UFQ06eQ,2017-12-05,Welcome to Hell - SNL,Saturday Night Live,Entertainment,2017-12-03 05:52:22,3707365,48888,7362,10610,False,False,False
4212,w4lcP5ZA4wg,2017-12-05,Special Dog Finds Family Who Loves All His Differences | The Dodo,The Dodo,Pets & Animals,2017-12-04 01:00:02,336662,11291,160,1287,False,False,False
4213,e77J4g0LMOk,2017-12-05,Little Mix bring the Power & CNCO to The X Factor Final! | Final | The X Factor 2017,The X Factor UK,Entertainment,2017-12-03 19:47:01,2121624,99783,2030,0,True,False,False
4214,92HCNclQOYo,2017-12-05,Alessandra Ambrosio’s Wax Sculpture,Victoria's Secret,Entertainment,2017-12-04 11:36:31,211403,6386,151,316,False,False,False
4215,a-4_6bThk2E,2017-12-05,"The rise of bad jobs, explained",Vox,News & Politics,2017-12-04 14:09:43,331367,10917,472,2561,False,False,False
4216,hRAGY4BaFQs,2017-12-05,Xscape's Tamika Scott Falls During Epic Wardrobe Malfunction Onstage | TMZ,TMZ,Entertainment,2017-12-04 20:02:25,56736,327,436,184,False,False,False
4217,48qcnpCWBq0,2017-12-05,Grace VanderWaal - So Much More Than This,GraceVanderWaalVEVO,Music,2017-12-04 11:00:01,479732,69709,509,5656,False,False,False
4218,6wHVgiM0R54,2017-12-05,Could You Actually Have An Anxiety Disorder?,Life Noggin,Education,2017-12-04 14:00:00,160340,9822,118,2063,False,False,False
4219,xejjA2AFO5I,2017-12-05,Black Mirror - Metalhead | Official Trailer [HD] | Netflix,Netflix,Entertainment,2017-12-03 11:00:04,433758,5407,108,724,False,False,False
4220,YF6xzqOfCD8,2017-12-05,"Batman's Village of Fools: Gotham, England",Tom Scott,Education,2017-12-04 16:00:02,153131,12441,48,548,False,False,False
4221,JR4oPuV3CWg,2017-12-05,4 Life Hacks that Will Ruin Your Life,Cracked,Comedy,2017-12-03 17:00:01,239226,6932,341,454,False,False,False
4222,spuXN0ccRQ8,2017-12-05,SHOCKING Science with a Leyden Jar,The King of Random,Education,2017-12-03 15:00:03,798301,17753,1142,3429,False,False,False
4223,DQQN_79QrDY,2017-12-05,"1,000,000 Dominoes Falling is Oddly SATISFYING",Hevesh5,Entertainment,2017-12-02 18:00:00,2073239,21391,1702,1954,False,False,False
4224,iMg9ibfcBnM,2017-12-05,DIY PIZZA POUCH & WEARABLE PIZZA,HellthyJunkFood,Entertainment,2017-12-03 14:00:06,165106,4670,902,1041,False,False,False
4225,JgByDCdtNE8,2017-12-05,Tiffany Haddish Details Her Dinners with Barbra Streisand & Taylor Swift,TheEllenShow,Entertainment,2017-12-04 15:15:08,174569,5616,74,497,False,False,False
4226,bXYkU5u5pzg,2017-12-05,Parris Campbell takes the screen pass 57 yards to the house | Highlights | FOX COLLEGE FOOTBALL,FOX Sports,Sports,2017-12-03 02:10:57,258271,1033,380,323,False,False,False
4227,l5S5DM564O8,2017-12-05,Arizona State introductory press conference of Herm Edwards,Pac-12 Networks,Sports,2017-12-04 18:32:36,19333,0,0,0,True,True,False
4228,GhcqN2FDAnA,2017-12-05,Senator's tax rant goes viral,CNN,News & Politics,2017-12-02 15:05:47,421286,6748,3657,5284,False,False,False
4229,oX4YCoO6tK4,2017-12-05,15 Toothpaste Life Hacks YOU SHOULD KNOW!,Wengie,Howto & Style,2017-12-02 18:48:02,2150401,61328,5880,12256,False,False,False
4230,bJNnsAmNoUc,2017-12-05,Josh Groban with Tony Bennett - Christmas Time Is Here (Official Music Video),Josh Groban,Music,2017-12-04 16:01:27,27459,947,62,76,False,False,False
4231,3SlG3sE8Ytg,2017-12-05,DIY Lasagna Roses - Man Vs Din,ThreadBanger,Howto & Style,2017-12-03 00:27:30,914633,44025,437,5286,False,False,False
4232,AWtpYfjylCo,2017-12-05,A Survivalist Teaches Me To Live Off The Grid,BuzzFeedBlue,People & Blogs,2017-12-02 16:00:55,288815,5507,731,553,False,False,False
4233,sxxJug2Ob_A,2017-12-05,Latino Hunger Games | Lele Pons,Lele Pons,Comedy,2017-12-02 18:30:25,3178950,155602,10546,12073,False,False,False
4234,8IEvxQKzLyI,2017-12-05,Making Chocolate Christmas Pudding with Mark Ferris | Tom Daley,Tom Daley,Sports,2017-12-03 18:00:00,52339,3285,79,370,False,False,False
4235,SM1w9PEQOE8,2017-12-05,Demi Lovato - Tell Me You Love Me,DemiLovatoVEVO,Music,2017-12-01 15:00:02,17931825,1066373,20288,69704,False,False,False
4236,X212iTIMfYU,2017-12-05,10 Hour Wear Test On Drugstore Makeup | Beauty With Mi | Refinery29,Refinery29,Howto & Style,2017-12-04 16:00:05,8957,329,13,45,False,False,False
4237,76-ui4F8DJ0,2017-12-05,Justice League Will Fail To Hit $700 Million At Box Office - Box Office Report,John Campea,Entertainment,2017-12-03 23:58:50,62122,1943,196,2208,False,False,False
4238,an6dsm86Kn4,2017-12-05,"INDIAN STREET FOOD of YOUR DREAMS in Kolkata, India | ENTER CURRY HEAVEN + BEST STREET FOOD in India",The Food Ranger,Travel & Events,2017-12-02 14:00:00,420650,12910,492,3890,False,False,False
4239,6SevTnFTdpA,2017-12-05,Ohio State vs. Wisconsin - Big Ten Championship Highlights,Big Ten Network,Sports,2017-12-03 05:35:07,71072,388,50,348,False,False,False
4240,SA7AIQw-7Ms,2017-12-05,G-Eazy & Halsey - Him & I (Official Video),GEazyMusicVEVO,Music,2017-12-01 16:15:00,8258471,414711,5794,21208,False,False,False
4241,olOdCkYIsrA,2017-12-05,How to Time Travel,Tech Insider,Science & Technology,2017-12-02 22:00:05,172031,5249,180,872,False,False,False
4242,Z48OG9917mg,2017-12-05,"How to Actually Finish Something, for Once",CollegeHumor,Comedy,2017-12-02 17:30:01,517703,19688,1008,923,False,False,False
4243,A34O0pCAQ60,2017-12-05,Urban Meyer reacts to Ohio State not making the College Football Playoff | ESPN,ESPN,Sports,2017-12-03 20:27:49,47614,358,30,457,False,False,False
4244,-rZkKvRZ0UE,2017-12-05,Pizza night!,"European Space Agency, ESA",Science & Technology,2017-12-02 20:01:53,122648,1643,64,218,False,False,False
4245,gkvhlo4a5iQ,2017-12-05,What If We Destroyed the Moon?,RealLifeLore,Education,2017-12-02 15:30:01,608273,20511,580,2850,False,False,False
4246,MQSRmx9zS64,2017-12-05,Top 10 Strangest Things That Happen To Your Body In Space,Be Amazed,Entertainment,2017-12-02 19:21:13,68913,1507,100,235,False,False,False
4247,OdpHOc7vqHA,2017-12-05,Testing Nail Products from Wish Nails Remove Toes Hollow Nail Polish Peel-off Nails Wish Buy Now,Simply Nailogical,Entertainment,2017-12-02 15:21:01,2706676,107981,1271,11252,False,False,False
4248,oFBuCp19L7M,2017-12-05,"The Cast of Star Wars: The Last Jedi Talk Kylo Ren, Jedi Controversy, Harrison Ford & Secrets",Jimmy Kimmel Live,Entertainment,2017-12-02 08:30:00,1127924,18949,437,1648,False,False,False
4249,EYLUUm9SLW0,2017-12-05,Christmas Cupcake Tower GONE WRONG with Joey Graceffa!,iJustine,People & Blogs,2017-12-02 21:08:41,177938,8578,526,953,False,False,False
4250,8cpqLRC7T80,2017-12-05,Fairy Lights Bedroom Makeover Goals! | Mr. Kate Decorates,Mr. Kate,Howto & Style,2017-12-02 19:00:01,543050,32403,459,2194,False,False,False
4251,B9127l-xpdE,2017-12-05,Best NBA Handles and Crossovers of the Month | November 2017,NBA,Sports,2017-12-02 14:00:01,153186,1395,72,185,False,False,False
4252,aSO1gltbg0o,2017-12-05,"The Big Ugly - Dramatic Rescue of a Fallen Big Wave Surfer - #Drone - Nazaré, Portugal",Máquina Voadora,Sports,2017-12-02 20:08:25,65799,749,18,51,False,False,False
4253,uUEdjGTIB9Y,2017-12-05,TEACHING KARLIE KLOSS HOW TO READ BRAILLE!,Molly Burke,People & Blogs,2017-12-02 18:30:04,47054,2491,91,252,False,False,False
4254,hBvcngHRTFg,2017-12-05,Jordan Peele Breaks Down Get Out Fan Theories from Reddit | Vanity Fair,Vanity Fair,Entertainment,2017-12-01 13:00:21,1338294,39583,710,2403,False,False,False
4255,EKkzbbLYPuI,2017-12-05,Lindsey Stirling - Carol of the Bells,Lindsey Stirling,Music,2017-12-01 16:01:15,2553735,144807,1683,6129,False,False,False
4256,uFUHjJQIC_4,2017-12-05,Nihon Nights: Discover Japan's custom supercar culture w/ Mad Mike.,Red Bull,Sports,2017-12-02 19:00:02,232142,6604,127,500,False,False,False
4257,44W9qstI8H8,2017-12-05,Taylor Swift - I Did Something Bad (Cover) | By Shoshana Bean and Cynthia Erivo,Shoshana Bean,Music,2017-12-01 16:45:59,404250,14258,428,988,False,False,False
4258,0doVNhCyoA4,2017-12-05,"PBS NewsHour Weekend full episode Dec. 2, 2017",PBS NewsHour,News & Politics,2017-12-02 22:29:20,21819,164,21,0,True,False,False
4259,chFKDaZns6w,2017-12-05,YouTube Creators for Change: Natalie Tran | White Male Asian Female,communitychannel,Entertainment,2017-12-01 22:11:00,263233,20412,2513,5956,False,False,False
4260,gob0unzEdRw,2017-12-05,Melania Trump Is Dreaming Of A Dark Christmas,The Late Show with Stephen Colbert,Entertainment,2017-12-01 08:35:00,1778470,18940,7048,4306,False,False,False
4261,4WnizmrnJlk,2017-12-05,Matt Lauer Sexual Harassment Allegations; Trump's Unhinged Tweets: A Closer Look,Late Night with Seth Meyers,Comedy,2017-12-01 02:00:01,2817216,26544,1323,3377,False,False,False
4262,DgOUdtUlL24,2017-12-05,My Pretty Little Liars Audition Tape! | Shay Mitchell,Shay Mitchell,Howto & Style,2017-12-01 19:00:00,3192347,147729,731,4112,False,False,False
4263,h8hMvvP_Bdo,2017-12-05,We Try Tiny Cooking,BuzzFeedVideo,People & Blogs,2017-12-01 19:00:29,1030745,24284,534,934,False,False,False
4264,bMrRN99DYKU,2017-12-05,Selena Gomez Tearfully Accepts Woman of the Year Award at Billboard's Women in Music 2017,Billboard,Music,2017-12-01 05:19:44,4160214,115911,4092,9003,False,False,False
4265,QF031DwMffQ,2017-12-05,『ニンジャバットマン』 New York Comic Con公開映像【2018年劇場公開予定】,ワーナー ブラザース 公式チャンネル,Film & Animation,2017-12-01 09:06:02,1236251,26283,1054,3773,False,False,False
4266,817P8W8-mGE,2017-12-05,Ed Sheeran - Perfect Duet (with Beyoncé) [Official Audio],Ed Sheeran,Music,2017-12-01 00:54:56,24409021,895415,17872,46589,False,False,False
